Title,Abstract,Authors,Publication Date
"A phase III, open-label clinical trial evaluating pegunigalsidase alfa administered every 4 weeks in adults with Fabry disease previously treated with other enzyme replacement therapies.","Pegunigalsidase alfa, a PEGylated α-galactosidase A enzyme replacement therapy (ERT) for Fabry disease, has a longer plasma half-life than other ERTs administered intravenously every 2 weeks (E2W). BRIGHT (NCT03180840) was a phase III, open-label study in adults with Fabry disease, previously treated with agalsidase alfa or beta E2W for ≥3 years, who switched to 2 mg/kg pegunigalsidase alfa every 4 weeks (E4W) for 52 weeks. Primary objective assessed safety, including number of treatment-emergent adverse events (TEAEs). Thirty patients were enrolled (24 males); 23 previously received agalsidase beta. Pegunigalsidase alfa plasma concentrations remained above the lower limit of quantification throughout the 4-week dosing interval. Thirty-three of 182 TEAEs (in 9 patients) were considered treatment-related; all were mild/moderate. No patients developed de novo anti-drug antibodies (ADAs). In the efficacy analysis (n = 29), median (inter-quartile range) eGFR change from baseline over 52 weeks was -1.9 (-5.9; 1.8) mL/min/1.73 m<sup>2</sup> (n = 28; males [n = 22]: -2.4 [-5.2; 3.2]; females [n = 6]: -0.7 [-9.2; 2.0]). Overall, median eGFR slope was -1.9 (-8.3; 1.9) mL/min/1.73 m<sup>2</sup>/year (ADA-negative [n = 20]: -1.2 [-6.4; 2.6]; ADA-positive [n = 9]: -8.4 [-11.6; -1.0]). Lyso-Gb3 concentrations were low and stable in females, with a slight increase in males (9/24 ADA-positive). The BRIGHT study results suggest that 2 mg/kg pegunigalsidase alfa E4W is tolerated well in stable adult patients with Fabry disease. Due to the low number of patients in this study, more research is needed to demonstrate the effects of pegunigalsidase alfa given E4W. Further evidence, outside of this clinical trial, should be factored in for physicians to prolong the biweekly ERT intervals to E4W. TAKE-HOME MESSAGE: Treatment with 2 mg/kg pegunigalsidase alfa every 4 weeks could offer a new treatment option for patients with Fabry disease.","Myrl Holida, Aleš Linhart, Antonio Pisani, Nicola Longo, François Eyskens, Ozlem Goker-Alpan, Eric Wallace, Patrick Deegan, Camilla Tøndel, Ulla Feldt-Rasmussen, Derralynn Hughes, Anat Sakov, Rossana Rocco, Einat Brill Almon, Sari Alon, Raul Chertkoff, David G Warnock, Stephen Waldek, William R Wilcox, John A Bernat",2024
Many faces of Fabry Disease - variable clinical course with typical non-cardiac symptoms and unexpected heart involvement.,,"Wojciech Wróbel, Zbigniew Olczak, Ewelina Szymańska, Katarzyna Mizia-Stec",2024
Fabry disease in female monozygotic twins with complex intronic haplotype variants: a case report.,"Fabry disease is an X-linked lysosomal storage disease caused by the impairment of α-galactosidase A. The complex intronic haplotype (CIH) variants, located in promoter and intronic regulatory lesions, has been found in patients with classical forms of Fabry disease. We present a case of Fabry disease in female monozygotic twins exhibiting the CIH mutation and classical manifestations.","Hong Sang Choi, Oh Il Kwon, Sung Sun Kim, Jae Yeong Cho, Eun Hui Bae, Seong Kwon Ma, Soo Wan Kim, Chang Seong Kim",2024
[Analysis of a family with Fabry disease with 15 patients].,,"J L Yang, J N Jiang, Z Y Wei, S Q Peng, B Wang, F M Wang, L Sun, W M He, X L Zhang",2024
[Pharmacological Chaperone Therapy for Fabry Disease].,"Pharmacological chaperone therapy (PCT) structurally stabilizes mutant enzyme proteins and increases their activity. Although ease of oral administration and effectiveness in patients with central nervous system disorders serve as advantages, PCT is effective only for patients with amenable mutations because its efficacy depends on gene mutations. PCT, which prevents progression of Fabry cardiomyopathy and nephropathy, was approved in Japan in 2018. It is expected that PCT will also be developed for lysosomal diseases that cause central nervous system disorders in the future.",Masahisa Kobayashi,2024
"Different diseases, different needs: Patient preferences for gene therapy in lysosomal storage disorders, a probabilistic threshold technique survey.","Gene therapy is currently in development for several monogenetic diseases including lysosomal storage disorders. Limited evidence is available on patient preferences for gene therapy in this population. In this study, we compare gene therapy-related risk tolerance between people affected by three lysosomal storage diseases currently faced with different therapeutic options and prognoses.","Eleonore M Corazolla, Eline C B Eskes, Jorien Veldwijk, Marion M M G Brands, Hanka Dekker, Erica van de Mheen, Mirjam Langeveld, Carla E M Hollak, Barbara Sjouke",2024
Investigation of serum neurofilament light chain as a biomarker in Fabry disease.,"Fabry disease (FD) constitutes a rare, X-linked lysosomal storage disorder affecting multiple organ systems, most notably heart, kidneys, and the central nervous system. Neurofilament light chains (NfL) have emerged as a prime candidate for a body fluid biomarker reflecting neuro-axonal injury. We aimed to evaluate its addition to the diagnostic and monitoring armamentarium in FD. Serum NfL concentrations (sNfL) were measured in 50 people with FD (PwFD) and 30 healthy control subjects (HC) using the Simoa© technology, followed by calculation of Z-scores adjusted for age and body mass index. In addition, clinical disease severity in PwFD was measured using the FOS-MSSI (Fabry outcome study - Mainz severity score index), which comprises clinical and paraclinical parameters. PwFD show elevated sNfL Z-scores compared to HC (PwFD: 1.12 [SD 1.5], HC: 0.01 [SD 1.2], p < 0.001). In PwFD, males showed higher sNfL Z-scores than females (1.75 [SD 1.5] vs. 0.73 [SD 1.4]). Importantly, sNfL Z-scores were increased in PwFD with ischemic white matter lesions of the CNS (1.5, SD 2.2 vs. 0.5, SD 2.9, p = 0.03). In our small cohort, sNfL Z-scores correlated fairly with FOS-MSSI (Kendall's-Tau [τ] = 0.25, p = 0.01), and, interestingly with serum creatinine (τ = 0.28, p = 0.005) and estimated glomerular filtration rate (eGFR, τ =-0.28, p = 0.005). Based on these exploratory results, sNfL might provide value as a biomarker of neuroaxonal damage in FD, possibly reflecting cerebrovascular injury. Additionally, the correlation of sNfL with renal function warrants further investigation.","Markus Ponleitner, Constantin Gatterer, Gabriel Bsteh, Jakob Rath, Patrick Altmann, Thomas Berger, Senta Graf, Gere Sunder-Plassmann, Paulus Stefan Rommer",2024
Decreased trabecular bone score in patients affected by Fabry disease.,"Fabry disease (FD) is an inherited X-linked lysosomal storage disease characterized by increased risk of osteoporosis and fractures. The impact of FD on clinical measures of bone quality is unknown. This considered, aim of our study was to evaluate whether trabecular bone microarchitecture, measured by trabecular bone score (TBS), is altered in patients with FD compared to control subjects.","Emanuele Varaldo, Beatrice Giannone, Francesca Viglino, Fabio Settanni, Fabio Bioletto, Marco Barale, Massimo Procopio, Silvia Deaglio, Ezio Ghigo, Andrea Benso",2024
"Insights of Fabry disease: Expert consensus approach for screening, diagnosis, and multidisciplinary management in chronic kidney disease.","The prevalence of Fabry disease (FD) among males with chronic kidney disease (CKD) of unknown etiology in Taiwan is 0.6%. Despite this, FD is frequently overlooked in clinical settings. To address this issue, two consensus meetings were conducted in Taiwan-one in August 2022 and another in April 2023. The first meeting established screening criteria based on age, gender, family history, cardiac involvement, and symptoms. The second meeting, with a multidisciplinary team, developed treatment recommendations. The consensus emphasizes the importance of proactive data collection in dialysis units and outpatient follow-ups to enhance FD detection and management. The screening algorithm recommends incorporating FD screening into the diagnostic process for CKD patients, regardless of age. Priority is given to patients with a family history of FD, early stroke history, or classical FD symptoms. Comprehensive screening is also advised for CKD patients without obvious classical symptoms. Screening protocols for males include measuring α-galactosidase A enzyme activity, with reduced activity leading to further tests such as lyso-Gb3 level quantification and genetic analysis. For females, the protocol involves evaluating lyso-Gb3 plasma levels and genetic testing. FD, though often underestimated, is more prevalent than recognized and necessitates a multidisciplinary approach for timely diagnosis. Enhancing awareness and adopting a comprehensive approach are essential for improving patient outcomes.","Cheng-Jui Lin, Feng-Jung Yang, Chih-Jen Wu, Ming-Ju Wu, Mai-Szu Wu",2024
Fabry Disease with Genetic Variants of Unknown Significance and Concomitant Immunoglobulin A Nephropathy.,The diagnosis of Fabry disease (FD) with genetic variants of unknown significance (VUSs) is relatively difficult. We explored patients with novel VUS variants and concomitant immunoglobulin A nephropathy (IgAN) to improve the understanding of VUS.,"Huan Zhou, Siqing Wang, Yilin Chen, Dandan Yang, Yi Tang, Jiaxing Tan, Wei Qin",2024
