Title,Abstract,Authors,Publication Date
Clinical-grade intranasal NGF fuels neurological and metabolic functions of Mecp2-deficient mice.,"MECP2 deficiency causes a broad spectrum of neuropsychiatric disorders that can affect both genders. Rett syndrome is the most common and is characterized by an apparently normal growth period followed by a regression phase in which patients lose most of their previously acquired skills. After this dramatic period, various symptoms progressively appear, including severe intellectual disability, epilepsy, apraxia, breathing abnormalities and motor deterioration. MECP2 encodes for an epigenetic transcription factor that is particularly abundant in the brain; consequently, several transcriptional defects characterize the Rett syndrome brain. The well-known deficiency of several neurotrophins and growth factors, together with the positive effects exerted by Trofinetide, a synthetic analogue of insulin-like growth factor 1, in Rett patients and in mouse models of Mecp2 deficiency, prompted us to investigate the therapeutic potential of nerve growth factor. Initial in vitro studies demonstrated a healing effect of rhNGF on neuronal maturation and activity in cultured Mecp2-null neurons. Subsequently, we designed in vivo studies with clear translational potential using intranasally administered recombinant human GMP-grade NGF (rhNGF) already used in the clinic. Efficacy of rhNGF in vivo in Mecp2-null hemizygous male mice and heterozygous female mice was assessed. General well-being was evaluated by a conventional phenotypic score and motor performance through the Pole and Beam Walking tests, while cognitive function and interaction with the environment were measured by the Novel Object Recognition Test and the Marble Burying test, respectively. At the end of the treatment, mouse cortices were dissected and bulk RNA sequencing was performed to identify the molecular pathways involved in the protective effects of rhNGF. rhNGF exerted positive effects on cognitive and motor functions in both male and female mouse models of Rett syndrome. In male hemizygous mice, which suffer from significantly more severe and rapidly advancing symptoms, the drug's ability to slow the disease's progression was more pronounced. The unbiased research for the molecular mechanisms triggering the observed benefits revealed a strong positive effect on gene sets related to oxidative phosphorylation, mitochondrial structure and function. These results were validated by demonstrating the drug's ability to improve mitochondrial structure and respiration in Mecp2-null cerebral cortices. Furthermore, GO analyses indicated that NGF exerted the expected improvement in neuronal maturation. We conclude that intranasal administration of rhNGF is a non-invasive and effective route of administration for the treatment of Rett syndrome and possibly for other neurometabolic disorders with overt mitochondrial dysfunction.","Diego Pozzer, Marzia Indrigo, Martina Breccia, Elena Florio, Camilla Aurora Franchino, Giuseppina De Rocco, Francesca Maltecca, Antonio Fadda, Marzia Rossato, Andrea Aramini, Marcello Allegretti, Angelisa Frasca, Lidia De Filippis, Nicoletta Landsberger",2024
Pharmacological inhibition of the CB1 cannabinoid receptor restores abnormal brain mitochondrial CB1 receptor expression and rescues bioenergetic and cognitive defects in a female mouse model of Rett syndrome.,"Defective mitochondria and aberrant brain mitochondrial bioenergetics are consistent features in syndromic intellectual disability disorders, such as Rett syndrome (RTT), a rare neurologic disorder that severely affects mainly females carrying mutations in the X-linked MECP2 gene. A pool of CB1 cannabinoid receptors (CB1R), the primary receptor subtype of the endocannabinoid system in the brain, is located on brain mitochondrial membranes (mtCB1R), where it can locally regulate energy production, synaptic transmission and memory abilities through the inhibition of the intra-mitochondrial protein kinase A (mtPKA). In the present study, we asked whether an overactive mtCB1R-mtPKA signaling might underlie the brain mitochondrial alterations in RTT and whether its modulation by systemic administration of the CB1R inverse agonist rimonabant might improve bioenergetics and cognitive defects in mice modeling RTT.","Livia Cosentino, Chiara Urbinati, Chiara Lanzillotta, Domenico De Rasmo, Daniela Valenti, Mattia Pellas, Maria Cristina Quattrini, Fabiana Piscitelli, Magdalena Kostrzewa, Fabio Di Domenico, Donatella Pietraforte, Tiziana Bisogno, Anna Signorile, Rosa Anna Vacca, Bianca De Filippis",2024
The Kir channel in the nucleus tractus solitarius integrates the chemosensory system with REM sleep executive machinery for homeostatic balance.,"The locus coeruleus (LC), nucleus tractus solitarius (NTS), and retrotrapezoid nucleus (RTN) are critical chemosensory regions in the brainstem. In the LC, acid-sensing ion channels and proton pumps serve as H<sup>+</sup> sensors and facilitate the transition from non-rapid eye movement (NREM) to rapid eye movement (REM) sleep. Interestingly, the potassium inward rectifier (KIR) channels in the LC, NTS, and RTN also act as H<sup>+</sup>-sensors and are a primary target for improving sleep in obstructive sleep apnea and Rett syndrome patients. However, the role of Kir channels in NREM to REM sleep transition for H<sup>+</sup> homeostasis is not known. Male Wistar rats were surgically prepared for chronic sleep-wake recording and drug delivery into the LC, NTS, and RTN. In different animal cohorts, microinjections of the Kir channel inhibitor, barium chloride (BaCl<sub>2</sub>), at concentrations of 1 mM (low dose) and 2 mM (high dose) in the LC and RTN significantly increased wakefulness and decreased NREM sleep. However, BaCl<sub>2</sub> microinjection into the LC notably reduced REM sleep, whereas it didn't change in the RTN-injected group. Interestingly, BaCl<sub>2</sub> microinjections into the NTS significantly decreased wakefulness and increased the percent amount of NREM and REM sleep. Additionally, with the infusion of BaCl<sub>2</sub> into the NTS, the mean REM sleep episode numbers significantly increased, but the length of the REM sleep episode didn't change. These findings suggest that the Kir channels in the NTS, but not in the LC and RTN, modulate state transition from NREM to REM sleep.","Fayaz A Mir, Sushil K Jha",2024
Vglut2-based glutamatergic signaling in central noradrenergic neurons is dispensable for normal breathing and chemosensory reflexes.,"Central noradrenergic (NA) neurons are key constituents of the respiratory homeostatic network. NA dysfunction is implicated in several developmental respiratory disorders including Congenital Central Hyperventilation Syndrome (CCHS), Sudden Infant Death Syndrome (SIDS), and Rett Syndrome. The current unchallenged paradigm in the field, supported by multiple studies, is that glutamate co-transmission in subsets of central NA neurons plays a role in breathing control. If true, NA-glutamate co-transmission may also be mechanistically important in respiratory disorders. However, the requirement of NA-derived glutamate in breathing has not been directly tested and the extent of glutamate co-transmission in the central NA system remains uncharacterized. Therefore, we fully characterized the cumulative fate maps and acute adult expression patterns of all three vesicular glutamate transporters (<i>Slc17a7</i> (Vglut1), <i>Slc17a6</i> (Vglut2), and <i>Slc17a8</i> (Vglut3)) in NA neurons, identifying a novel, dynamic expression pattern for Vglut2 and an undescribed co-expression domain for Vglut3 in the NA system. In contrast to our initial hypothesis that NA-derived glutamate is required to breathing, our functional studies showed that loss of Vglut2 throughout the NA system failed to alter breathing or metabolism under room air, hypercapnia, or hypoxia in unrestrained and unanesthetized mice. These data demonstrate that Vglut2-based glutamatergic signaling within the central NA system is not required for normal baseline breathing and hypercapnic, hypoxic chemosensory reflexes. These outcomes challenge the current understanding of central NA neurons in the control of breathing and suggests that glutamate may not be a critical target to understand NA neuron dysfunction in respiratory diseases.","Yuan Chang, Savannah Lusk, Andersen Chang, Christopher S Ward, Russell S Ray",2024
Modeling antisense oligonucleotide therapy in MECP2 duplication syndrome human iPSC-derived neurons reveals gene expression programs responsive to MeCP2 levels.,"Genomic copy-number variations (CNVs) that can cause neurodevelopmental disorders often encompass many genes, which complicates our understanding of how individual genes within a CNV contribute to pathology. MECP2 duplication syndrome (MDS or MRXSL in OMIM; OMIM#300260) is one such CNV disorder caused by duplications spanning methyl CpG-binding protein 2 (MECP2) and other genes on Xq28. Using an antisense oligonucleotide (ASO) to normalize MECP2 dosage is sufficient to rescue abnormal neurological phenotypes in mouse models overexpressing MECP2 alone, implicating the importance of increased MECP2 dosage within CNVs of Xq28. However, because MDS CNVs span MECP2 and additional genes, we generated human neurons from multiple MDS patient-derived induced pluripotent cells (iPSCs) to evaluate the benefit of using an ASO against MECP2 in a MDS human neuronal context. Importantly, we identified a signature of genes that is partially and qualitatively modulated upon ASO treatment, pinpointed genes sensitive to MeCP2 function, and altered in a model of Rett syndrome, a neurological disorder caused by loss of MeCP2 function. Furthermore, the signature contained genes that are aberrantly altered in unaffected control human neurons upon MeCP2 depletion, revealing gene expression programs qualitatively sensitive to MeCP2 levels in human neurons. Lastly, ASO treatment led to a partial rescue of abnormal neuronal morphology in MDS neurons. All together, these data demonstrate that ASOs targeting MECP2 benefit human MDS neurons. Moreover, our study establishes a paradigm by which to evaluate the contribution of individual genes within a CNV to pathogenesis and to assess their potential as a therapeutic target.","Sameer S Bajikar, Yehezkel Sztainberg, Alexander J Trostle, Harini P Tirumala, Ying-Wooi Wan, Caroline L Harrop, Jesse D Bengtsson, Claudia M B Carvalho, Davut Pehlivan, Bernhard Suter, Jeffrey L Neul, Zhandong Liu, Paymaan Jafar-Nejad, Frank Rigo, Huda Y Zoghbi",2024
Ex vivo disease modelling of Rett syndrome: the transcriptomic and metabolomic implications of direct neuronal conversion.,"Rett syndrome (RTT) is a rare neurodevelopmental disorder that primarily affects females and is characterized by a period of normal development followed by severe cognitive, motor, and communication impairment. The syndrome is predominantly caused by mutations in the MECP2. This study aimed to use comprehensive multi-omic analysis to identify the molecular and metabolic alterations associated with Rett syndrome.","Beren Karaosmanoglu, Gozde Imren, M Samil Ozisin, Tuba Reçber, Pelin Ozlem Simsek Kiper, Goknur Haliloglu, Mehmet Alikaşifoğlu, Emirhan Nemutlu, Ekim Z Taskiran, Gulen Eda Utine",2024
MeCP2 Deficiency Alters the Response Selectivity of Prefrontal Cortical Neurons to Different Social Stimuli.,"Rett syndrome (RTT), a severe neurodevelopmental disorder caused by mutations in the MeCP2 gene, is characterized by cognitive and social deficits. Previous studies have noted hypoactivity in the medial prefrontal cortex (mPFC) pyramidal neurons of MeCP2-deficient mice (RTT mice) in response to both social and nonsocial stimuli. To further understand the neural mechanisms behind the social deficits of RTT mice, we monitored excitatory pyramidal neurons in the prelimbic region of the mPFC during social interactions in mice. These neurons' activity was closely linked to social preference, especially in wild-type mice. However, RTT mice showed reduced social interest and corresponding hypoactivity in these neurons, indicating that impaired mPFC activity contributes to their social deficits. We identified six mPFC neural ensembles selectively tuned to various stimuli, with RTT mice recruiting fewer neurons to ensembles responsive to social interactions and consistently showing lower stimulus-ON ensemble transient rates. Despite these lower rates, RTT mice exhibited an increase in the percentage of social-ON neurons in later sessions, suggesting a compensatory mechanism for the decreased firing rate. This highlights the limited plasticity in the mPFC caused by MeCP2 deficiency and offers insights into the neural dynamics of social encoding. The presence of multifunctional neurons and those specifically responsive to social or object stimuli in the mPFC emphasizes its crucial role in complex behaviors and cognitive functions, with selective neuron engagement suggesting efficiency in neural activation that optimizes responses to environmental stimuli.","Natalie Boyle, Yipeng Li, Xiaoqian Sun, Pan Xu, Chien-Hsien Lai, Sarah Betts, Dian Guo, Rahul Simha, Chen Zeng, Jianyang Du, Hui Lu",2024
Integrating DIA Single-Cell Proteomics Data with the DiagnoMass Proteomic Hub for Biological Insights.,"Single-cell proteomics has emerged as a powerful technology for unraveling the complexities of cellular heterogeneity, enabling insights into individual cell functions and pathologies. One of the primary challenges in single-cell proteomics is data generation, where low mass spectral signals often preclude the triggering of MS2 events. This challenge is addressed by Data Independent Acquisition (DIA), a data acquisition strategy that does not depend on peptide ion isotopic signatures to generate an MS2 event. In this study, we present data generated from the integration of DIA single-cell proteomics with a version of the DiagnoMass Proteomic Hub that was adapted to handle DIA data. DiagnoMass employs a hierarchical clustering methodology that enables the identification of tandem mass spectral clusters that are discriminative of biological conditions, thereby reducing the reliance on search engine biases for identifications. Nevertheless, a search engine (in this work, DIA-NN) can be integrated with DiagnoMass for spectral annotation. We used single-cell proteomic data from iPSC-derived neuroprogenitor cell cultures as a test study of this integrated approach. We were able to differentiate between control and Rett Syndrome patient cells to discern the proteomic variances potentially contributing to the disease's pathology. Our research confirms that the DiagnoMass-DIA synergy significantly enhances the identification of discriminative proteomic signatures, highlighting critical biological variations such as the presence of unique spectra that could be related to Rett Syndrome pathology.","Aline M A Martins, Marlon D M Santos, Amanda C Camillo-Andrade, Aline Lima Leite, Janaina Sena Souza, Sandra Sánchez, Alysson R Muotri, Paulo Costa Carvalho, John R Yates",2024
Nitrogen-containing heterocyclic drug products approved by the FDA in 2023: Synthesis and biological activity.,"This article profiles 13 newly approved nitrogen-containing heterocyclic drugs by the U.S. Food and Drug Administration (FDA) in 2023. These drugs target a variety of therapeutic areas including proteinuria in patients with IgA nephropathy, migraine in adults, Rett syndrome, PI3Kδ syndrome, vasomotor symptoms, alopecia areata, acute myeloid leukemia, postpartum depression, myelofibrosis, and various cancer and tumor types. The molecular structures of these approved drugs feature common aromatic heterocyclic compounds such as pyrrole, imidazole, pyrazole, isoxazole, pyridine, and pyrimidine, as well as aliphatic heterocyclic compounds like caprolactam, piperazine, and piperidine. Some compounds also contain multiple heteroatoms like 1,2,4-thiadiazole and 1,2,4-triazole. The article provides a comprehensive overview of the bioactivity spectrum, medicinal chemistry discovery, and synthetic methods for each compound.","Weijiang Luo, Yiqi Liu, Hui Qin, Zeyan Zhao, Suqi Wang, Weimin He, Shengsong Tang, Junmei Peng",2024
Exploring the Clinical Utility of Targeted MECP2 Testing in Real-World Practice.,This study aimed to explore the clinical utility of targeted MECP2 testing in a large cohort of females with neurodevelopmental delays. Our aim was to identify suitable candidates for testing based on prevailing diagnostic criteria.,"Soo Yeon Kim, Hyewon Woo, Byung Chan Lim, Ki Joong Kim, Jong-Hee Chae",2024
