Title,Abstract,Authors,Publication Date
Vaccination practices and knowledge among adults with hemoglobinopathies in Greece: a nationwide survey.,"Hemoglobinopathies, such as sickle cell disease and thalassemia, are genetic disorders that affect hemoglobin structure or production, leading to various health complications, including an increased risk of infections. Vaccinations play a crucial role in managing these conditions by providing essential protection against preventable diseases. Ensuring timely and appropriate immunizations is vital for reducing infection-related morbidity and improving the overall health and quality of life for affected individuals.","Sophia Delicou, Konstantinos Manganas, Aikaterini Xydaki, Loukia Evliati, Ioanna Myrilla, Leonidas Rubatis, Stavroula Kostaridou",2024
Immunization strategies for individuals with sickle cell anemia: A narrative review.,"Sickle cell anemia (SCA) is a hereditary blood disorder characterized by the production of abnormal hemoglobin, leading to the formation of sickle-shaped red blood cells. These distorted cells can obstruct blood flow, causing vaso-occlusive crises and increasing the risk of severe infections due to functional asplenia and immune system dysregulation. Immunization is a crucial strategy to mitigate infection-related complications in individuals with SCA, necessitating a comprehensive and tailored vaccination approach. Current immunization guidelines for individuals with SCA recommend a combination of standard and additional vaccines to address their heightened susceptibility to infections. Key vaccines include pneumococcal conjugate (PCV13) and polysaccharide (PPSV23) vaccines, meningococcal conjugate (MenACWY) and serogroup B (MenB) vaccines, Haemophilus influenzae type b (Hib) vaccine, annual influenza vaccine, and hepatitis A and B vaccines. These vaccinations aim to provide broad protection against pathogens that pose significant risks to patients with SCA. Despite generally adequate immune responses, the variability in vaccine efficacy due to immune dysfunction necessitates booster doses and additional vaccinations. This narrative review highlights the importance of adhering to current immunization recommendations and addresses challenges such as access to care, vaccine hesitancy, and monitoring vaccination status.","Emmanuel Ifeanyi Obeagu, Getrude Uzoma Obeagu",2024
Stroke Prevention and Treatment for Youth with Sickle Cell Anemia: Current Practice and Challenges and Promises for the Future.,"Sickle cell anemia (SCA) is an autosomal recessive inherited hemoglobinopathy that results in a high risk of stroke. SCA primarily affects an underserved minority population of children who are frequently not receiving effective, multi-disciplinary, preventative care. This article reviews primary and secondary stroke prevention and treatment for children with SCA for the general adult and pediatric neurologist, who may play an important role in providing critical neurologic evaluation and care to these children.","Susan Creary, Melissa G Chung, Anthony D Villella, Warren D Lo",2024
Characterizing medical decision-making in sickle cell disease during childhood: Qualitative perspectives of caregivers.,"Sickle cell disease (SCD) is the most common genetic disorder among children. As the most common type of SCD, sickle cell anemia (SCA) is associated with severe complications across the lifespan. As parents/caregivers hold primary disease management responsibility during childhood, their involvement in disease management activities, including medical decision-making, is critical to successful and timely management of pediatric SCD. However, the processes through which caregivers make SCD-related decisions remain unknown. The current paper examined caregivers' decision-making processes and priorities when managing their child's SCD.","Ariel O Blakey, Christina M Amaro, Jenna Sandler Eilenberg, Annelise Brochier, Patricia L Kavanagh, Arvin Garg, Mari-Lynn Drainoni, Kristin Long",2024
Therapeutic Gene Editing for Hemoglobinopathies.,"In the last ten years, a consistent number of clinical studies have evaluated different gene approaches for the treatment of patients with sickle cell disease (SCD) and transfusion-dependent β-thalassemia (TDT). Initial studies of gene therapy for hemoglobinopathies involved the use of lentiviral vectors to add functional copies of the gene encoding β-globin in defective CD34 cells; more recently, gene editing techniques have been used involving either CRISPR-Cas9, transcription activation-like effector protein nuclease, zinc finger nuclease, and base editing to either induce fetal hemoglobin production at therapeutic levels or to genetically repair the underlying molecular defect causing the disease. Here, we review recent gene editing studies that have started the development of a new era in the treatment of hemoglobinopathies and, in general, monoallelic hereditary diseases.","Ugo Testa, Giuseppe Leone, Maria Domenica Cappellini",2024
Global awareness of antigenic peptides - Unraveling the impact on sickle cell anemia patients in the presence of pathogens: A narrative review.,"Sickle cell anemia (SCA) is a genetic blood disorder characterized by the production of abnormal hemoglobin S (HbS), leading to sickle-shaped red blood cells and various complications, including increased susceptibility to infections. The presence of antigenic peptides, short amino acid sequences derived from pathogens or altered self-proteins, plays a crucial role in immune responses. This review explores the global awareness of antigenic peptides, their role in immune responses in SCA patients, and the challenges and opportunities in managing infections within this vulnerable population. Antigenic peptides are central to the adaptive immune response, facilitating the recognition and elimination of pathogens by T-cells. In SCA, altered antigen presentation and impaired T-cell responses due to chronic inflammation, functional asplenia, and ongoing hemolysis contribute to increased susceptibility to infections. Pathogens such as Streptococcus pneumoniae and Haemophilus influenzae pose significant risks to SCA patients, highlighting the importance of robust immune responses mediated by antigenic peptides. Strategies such as vaccination and immunotherapy aim to enhance immune function by targeting specific antigenic peptides, thereby reducing infection rates and improving patient outcomes. Advances in genomics and proteomics offer insights into individual variations in antigen presentation and immune responses, guiding the development of tailored therapeutic interventions. Global collaborations are essential to address disparities in healthcare access and implement effective preventive measures, ensuring equitable outcomes for SCA patients worldwide.",Emmanuel Ifeanyi Obeagu,2024
Impact of oral health conditions on the quality of life of children and adolescents with sickle cell anemia: A cross-sectional study.,Sickle cell anemia (SCA) is the most common hemoglobinopathy in Brazil and worldwide and is part of a group of chronic genetic diseases resulting from abnormalities in the structure of hemoglobin.,"Graça Maria Lopes Mattos, Cayara Mattos Costa, Adriana Santos Malheiros, Miriam Batalha Maciel, Daniela Bassi-Dibai, Meire Coelho Ferreira, Rudys Rodolfo De Jesus Tavarez",2024
Epidemiological profile trends and cost of pediatric sickle cell disease in Brazil from 2008 to 2022.,"This study aimed to investigate the epidemiological trends of Pediatric Sickle Cell Disease (SCD) in Brazil over the period 2008-2022, with a focus on understanding the incidence, mortality rates, and associated healthcare costs. The study explored potential associations between patient characteristics and the occurrence of crises in pediatric SCD cases.","Luiza Telles, Paulo Henrique Moreira Melo, Luana Baptistele Dornelas, Gabriele Eckerdt Lech, Natália Zaneti Sampaio, Ayla Gerk, Madeleine Carroll, Cristina Pires Camargo",2024
Impaired phagocytosis and oxidative respiratory burst activity in sickle cell anemia leukocytes.,This case-control study investigated the mode of leukocyte function in sickle cell anemia (SCA) to delineate the underlying immunopathology for early diagnosis and mitigate the increased bacterial infection risk in this patient population.,"David B Akinbo, Olutayo I Ajayi, Onyinye M Eluji, Imisioluwa Olatunji, Temisan M Okoroloko",2024
Conservative management of segmental testicular infarction in a patient with sickle cell anemia: A case report.,"Vaso-occlusive crisis is a sequela of sickle cell disease that can lead to severe pain and infarction at the location of occlusion. In men, genitourinary complications include priapism, hematuria, and very rarely, testicular infarction. Few cases have been previously reported in the literature, but in all of those cases, partial or complete orchiectomy was performed. We report the first known case of segmental testicular infarct secondary to sickle cell disease treated with medical management without need for surgical intervention.","Sarah Y Wu, Evan Mackenize Gibbs, Charles Klose, Neda Qosja, Andrew Zganjar, Bryce A Baird",2024
Eosinophilic dialogues: a molecular exploration of sickle cell anemia severity.,"Sickle cell anemia (SCA) is a genetically inherited hemoglobinopathy characterized by the abnormal morphology of red blood cells, resulting in vaso-occlusive events and diverse clinical complications. Recent investigations have unveiled a novel dimension in understanding SCA severity through the lens of eosinophilic dialogues. This review article synthesizes current knowledge on the molecular intricacies of eosinophils in the context of SCA, exploring their biology, molecular markers, and interactions with other cellular components. Eosinophil-mediated inflammation and oxidative stress are dissected to elucidate their impact on the disease course. Furthermore, the review evaluates potential therapeutic interventions and outlines future directions in this burgeoning field. The term ""Eosinophilic Dialogues"" encapsulates the multifaceted molecular exchanges that influence SCA severity, presenting a promising avenue for targeted interventions and improved clinical outcomes. This review serves as a comprehensive resource for researchers, clinicians, and healthcare practitioners engaged in unraveling the complex pathophysiology of SCA and exploring novel therapeutic avenues.",Emmanuel Ifeanyi Obeagu,2024
