Title,Abstract,Authors,Publication Date
von Hippel-Lindau Syndrome and Secondary Hypertension: A Case Report.,"von Hippel-Lindau (VHL) syndrome (OMIM #193300) is an autosomal dominant disorder with incomplete penetrance occurring due to a mutation in the <i>VHL</i> gene present on chromosome 3. We present the case of a 21-year-old male with a history of retinoblastoma presenting with intermittent headaches for one month. He was a known hypertensive and his blood pressure on presentation was 180/100 mmHg. A secondary cause for his hypertension was sought. Multiple cysts in his pancreas, both his kidneys, and a mass in the right suprarenal fossa were detected on an abdominal ultrasonogram and a subsequent computed tomography scan of the abdomen. VHL and a pheochromocytoma were suspected, and a positron emission tomography-computed tomography scan was done which collaborated with the above findings. The presence of multiple cystic lesions in the pancreas and kidneys, especially in an individual with a family history of VHL syndrome, should alert the physician to the possibility of VHL syndrome. The need for evaluation of causes for hypertension, especially in young individuals with resistant hypertension, is also highlighted.","Sharan Bose, Kandasamy Venkataraju Rajalakshmi, Ananthakumar Perumal Kumaresan, Jibin Simon",2024
Cauda equina myxopapillary ependymoma in von Hippel-Lindau disease: A case report.,Patients affected by Von Hippel-Lindau (VHL) are prone to develop central nervous system neoplasms such as hemangioblastomas (HBs). Myxopapillary ependymoma (MPE) is not commonly associated with VHL disease.,"Lucas Ribeiro, Valérie Rigau, Luc Bauchet",2024
"Characterization of spinal hemangioblastomas in patients with and without von Hippel-Lindau, and YAP expression.","Hemangioblastoma (HB) is a benign tumor of the central nervous system, associated with von Hippel-Lindau disease (VHL), or sporadic. The aim of this study was to compare and examine the clinical-pathological profile of patients with spinal hemangioblastoma and YAP expression.","Ana-Laura Calderón-Garcidueñas, Steven-Andrés Piña-Ballantyne, Eunice-Jazmín Espinosa-Aguilar, Rebeca de Jesús Ramos-Sánchez",2024
Technical Considerations for the Surgical Management of a C2 Spinal Cord Hemangioblastoma and Subjacent Cervical Spondylotic Myelopathy: A 2-Dimensional Operative Video.,"Hemangioblastomas are characterized as benign tumors of the central nervous system and are typically associated with von Hippel-Lindau disease in 20% to 30% of patients.1 Spinal hemangioblastomas are rare entities accounting for 2.1% of spinal cord tumors and are most frequently observed in the cervical spinal region.1-4 Treatment interventions include microsurgical resection and stereotactic radiosurgery.5 Understanding the granular detail of surgical management in these complex cases is necessary for optimal clinical outcomes. In this 2-dimensional operative video, we detail the technical nuances for resection of a World Health Organization Grade I hemangioblastoma in the upper cervical spine of a 51-year-old man. The lesion and severe adjacent canal stenosis resulted in extensive spinal cord compression, causing him to experience progressive myelopathic symptoms and neurological deficits. A C1-C7 laminectomy provided exposure of the hemangioblastoma and adequate decompression of the subjacent spondylotic disease. Intraoperative ultrasound was used to localize the tumor and perform a targeted durotomy. The sunburst-colored lesion was eccentric to the left side of C1-C2 and found in the epi-pial region, with pial thickening present in the surrounding area. The feeding vessels and deep draining vein were coagulated and cut. Low-power suction was used for traction/counter-traction dissection of the tumor planes. Owing to a multilevel laminectomy having been performed, hardware placement was performed from C2-T1. Adequate placement of all screws was confirmed with intraoperative 3-dimensional image acquisition. The patient provided informed consent for the operation and for sharing his clinical information, including digital media, for publication; Institutional Review Board not required per institutional policy.","Olivia E Gilbert, Mia Cranmer, Michael Galgano",2024
Comprehensive treatment of von Hippel-Lindau disease: A case report.,"von Hippel-Lindau (VHL) disease is a rare autosomal dominant multiorgan disease characterized by several benign and malignant tumors rich in vascular, as well as cysts in other organs. A great clinical treatment strategy is significantly warranted for good prognosis of patients with VHL disease. Herein, we reported a case of a 45-year-old woman diagnosed with VHL disease with spinal hemangioblastoma (HB) and clear cell renal cell carcinoma (ccRCC). Four years after the resection of the right kidney, a recurrent RCC in the right kidney and a malignant lesion in the left kidney were observed. This patient was started on sorafenib (800 mg, daily) and tislelizumab (200 mg per 3 weeks). After 6 months of treatment, the size of renal cell carcinoma was dramatically reduced and renal function improved. More importantly, she achieved partial response during the whole treatment. Microscopically, intramedullary masses resection was done and the HB in T4-5 thoracic spinal was removed. Neurologic symptoms such as numbness and pain were remarkably alleviated. Additionally, tislelizumab-induced elevation in liver transaminase levels and hypothyroidism were revered by hepatoprotector and levothyroxine, respectively. In short, comprehensive treatment strategies may benefit patients with VHL disease, especially with HB and ccRCC.","Xuesong Li, Zheng Mo, Zhuo Yu",2024
