Title,Abstract,Authors,Publication Date
Spinal cord hemangioblastomas in von Hippel-Lindau disease.,von Hippel-Lindau disease (VHL) is an autosomal dominant familial neoplasia syndrome. The most common manifestation of VHL is central nervous system hemangioblastomas. VHL patients will often develop multiple hemangioblastomas along their craniospinal axis over their lifetime. Spinal cord hemangioblastomas account for nearly half of all nervous system hemangioblastomas in VHL.,"Daniel C Kreatsoulas, Russell R Lonser",2024
Current views on the role of HIF-2α in the pathogenesis and syndromic presentation of pheochromocytoma and paraganglioma.,"Pathogenic variants (PVs) in EPAS1, which encodes hypoxia-inducible factor-2α (HIF-2α), could be the underlying genetic cause of about 3%-6% of pheochromocytoma and paragangliomas (PPGLs). EPAS1-related PPGLs may occur as isolated tumors or as part of Pacak-Zhuang Syndrome (PZS) with two or more of a triad of PPGL, polycythemia, and somatostatinoma. HIF-2α plays a critical role in the regulation of the cellular hypoxia pathway. When a gain-of-function PV is acquired, HIF-2α evades steady-state hydroxylation by the prolyl hydroxylase type 2 (PHD2), which accelerates von Hippel-Lindau (VHL)-mediated proteasomal degradation. In this situation, HIF-2α is stabilized and can translocate to the nucleus, inducing the expression of several genes involved in tumorigenesis. This leads to the development of PPGL and other manifestations of PZS. EPAS1-related PPGLs usually occur in the second or third decade of life, more frequently in females, and are usually multiple, adrenal and extra-adrenal, and norepinephrine-secreting. In addition, these tumors carry an increased metastatic potential and have been reported with metastatic disease in up to 30% of cases. While polycythemia is fairly common in PZS, somatostatinomas are rare. It has been suggested that the character of the acquired PV in EPAS1, which affects its binding to PHD2, correlates with certain phenotypes in PZS. PVs in EPAS1 that have been found in related sporadic PPGLs have also been associated with hypoxic conditions including cyanotic congenital heart disease, hemoglobinopathies and high altitude. Understanding the hypoxia pathway and its role in the pathogenesis of PPGL may open a new avenue for developing effective therapies for these tumors. Indeed, one of these therapies is Belzutifan, a HIF-2α inhibitor that is being tested in the treatment of metastatic PPGLs.","Nicole Bechmann, Jared S Rosenblum, Ali S Alzahrani",2024
Comparative analysis of stereotactic radiosurgery outcomes for supratentorial hemangioblastomas in von hippel-lindau disease and sporadic cases: A multi-center international study.,"Hemangioblastomas (HBs) are rare, benign central nervous system (CNS) neoplasms that rarely occur in the supratentorial. Resection with the goal of gross total resection (GTR) is often considered the primary treatment. Stereotactic radiosurgery (SRS) has been utilized more commonly in unresectable or partially resected cases. In this study, we aimed to evaluate SRS's effectiveness and clinical outcomes in supratentorial HBs.","Salem M Tos, Bardia Hajikarimloo, Georgios Mantziaris, Ahmed Shaaban, Duy Pham, Sam Dayawansa, Zhishuo Wei, Lindsay M McKendrick, Ajay Niranjan, L Dade Lunsford, Selcuk Peker, Yavuz Samanci, Roman Liscak, Jaromir May, David Mathieu, Piero Picozzi, Andrea Franzini, Ronald E Warnick, Jonathan E Schoenhals, Joshua D Palmer, Zhiyuan Xu, Jason P Sheehan",2024
Multisystem diseases in the abdomen and pelvis: imaging manifestations and diagnostic roles of cross-sectional imaging.,"Systemic diseases, such as IgG4-related disease, sarcoidosis, and amyloidosis, usually involve multiple systems or organs simultaneously or sequentially. The gastrointestinal tract, hepatobiliary system, and genitourinary tract are commonly involved in many multisystem diseases and can also be the first sites with disease involvement. Cross-sectional imaging, such as CT and MR, plays an important role in the diagnosis and management of multisystem diseases by aiding in the evaluation of multiorgan involvement. Here, common imaging features of frequently affected organs are reviewed in multisystem diseases that we often encounter in the abdomen and pelvis, and the diagnostic roles of cross-sectional imaging for these diseases are also discussed.","Mi Hye Yu, Young Jun Kim, Sungeun Park, Hee Sun Park, Sung Il Jung",2024
Follow-up report on pulmonary mucosa-associated lymphoma in a patient with von Hippel-Lindau disease.,"With the increasing opportunities for medical management of von Hippel-Lindau (VHL)-related lesions, fundamental questions are arising regarding the possibilities of the FDA-approved medication (Belzutifan) to delay the progression of other non-VHL-related tumors that are not requiring urgent surgical interventions. We present a follow-up report on a VHL patient, with a co-morbid history of pulmonary mucosa-associated lymphoid tissue lymphoma, who was initially described in the clinical scientific literature ~10 years ago. This patient's case highlights some of the challenges for some VHL patients with comorbid non-VHL-related tumors and potential opportunities for targeted support.","Bukola A Olarewaju, Judy B Tejon, Mayowa A Osundiji",2024
Genotype-phenotype correlation of ocular von Hippel-Lindau disease in Koreans.,"This scientific report aims to investigate the genotype-phenotype correlations of retinal hemangioblastoma (RH) in von Hippel-Lindau (VHL) disease. The study included 77 patients with genetically confirmed VHL disease who visited an ophthalmology clinic for the evaluation of RH. The presence, location, and size of RH were evaluated, Patients were categorized into three groups based on variants: HIF-1α binding site missense (HM), non-HIF-1α binding site missense (nHM), and truncating (TR) mutations. Fifty-six patients (72.7%) had RH in either eye, and 24 had bilateral RH. Sixteen patients (20.8%) had juxtapapillary RH in either eye. Nine patients had RH ≥ 2.0 disc diameters in size. VHL c.208G>A variant was the most frequent single mutation. Compared with patients having nHM mutations (15 patients) in VHL gene, patients with HM mutations (33 patients) or TR mutations (26 patients) presented a greater number of eyes affected (p = 0.007 and 0.004, respectively), a greater number of RH (p = 0.012 and 0.003, respectively), and more frequent presentation of large RH ≥ 2.0 disc diameters (p = 0.012, and 0.013, respectively). In conclusion, this study provides a deeper understanding of the genetic spectrum of VHL disease in Korean VHL disease and highlights the importance of the location of missense mutations regarding the risk of RH.","Sungsoon Hwang, Se Woong Kang, Jong-Won Kim, Sang Jin Kim",2024
Familial and early recurrent pheochromocytoma in a child with a novel in-frame duplication variant of <i>VHL</i>.,"Pheochromocytomas and paragangliomas (PPGLs) are rare neuroendocrine tumors often linked to underlying genetic variants. Genetic analysis can promote gene-adjusted, specific follow-up, and surveillance protocols for both patients and their families at risk. We report the case of a 7-yr-old boy with bilateral pheochromocytoma, which recurred a year after partial adrenalectomy. The patient's father developed bilateral pheochromocytomas at 25 yr of age. Both individuals possessed a novel heterogeneous in-frame duplication germline variant of <i>VHL</i>, yet neither exhibited other clinical manifestations of von Hippel-Lindau disease (VHL). Traditionally, <i>VHL</i> missense mutations have been associated with a higher risk of PPGL development, whereas truncating mutations typically confer a lower risk. In-frame duplication variants are rarely observed in patients with VHL but may lead to changes in the three-dimensional structure of the translated protein, similar to truncating variants. Our analysis suggests that these in-frame duplications of amino acids in specific regions may cause pheochromocytomas in a manner similar to missense variants. Further accumulation of VHL cases with various genotypes and standardized open-access worldwide databases, including longitudinal and specific clinical data linked to genotypes, is required. It is crucial to consider genetic analyses for pediatricians who may diagnose childhood-onset PPGL.","Yuri Suzuki, Ryosei Iemura, Akito Sutani, Yuki Mizuno, Eriko Adachi, Mineko Ushiama, Teruhiko Yoshida, Makoto Hirata, Akihiro Hoshino, Kurara Yamomoto, Takumi Akashi, Yoshiko Nakano, Takeshi Isoda, Kei Takasawa, Motohiro Kato, Masatoshi Takagi, Kentaro Okamoto, Tomohiro Morio, Kenichi Kashimada",2024
Application of carbonic anhydrase IX in sporadic hemangioblastoma of the central nervous system and hemangioblastoma associated with von Hippel-Lindau disease.,This research aims to examine the expression of carbonic anhydrase IX (CAIX) protein in hemangioblastoma of the central nervous system and its potential application in pathological diagnosis and differential diagnosis.,"Xue Chen, Xiaoxiang Gao, Jiaqi Bo, Haixia Bi, Haoyang Zhang, Yuting Liu, Jie Yu, Xianghua Yi, Fei Wang, Suxia Zhang, Yu Zeng",2024
A novel pathogenic germline chromosome 3 inversion in von Hippel-Lindau disease.,"von Hippel-Lindau (VHL) is an autosomal-dominant hereditary tumour susceptibility disease associated with pathogenic germline variants in the <i>VHL</i> tumour suppressor gene. VHL patients are at increased risk of developing multiple benign and malignant tumours. Current CLIA-based genetic tests demonstrate a very high detection rate of germline <i>VHL</i> variants in patients with clinical manifestations of VHL. In this report, we describe a large family with canonical VHL manifestations, for which no germline alteration had been detected by conventional germline testing. We identified a novel 291 kb chromosomal inversion involving chromosome 3p in affected family members. This inversion disrupts the <i>VHL</i> gene between exon 2 and exon 3 and is thereby responsible for the disease observed in this family.","Cathy D Vocke, Christopher J Ricketts, Svetlana Pack, Mark Raffeld, Stephen Hewitt, Alexandra P Lebensohn, Lidenys O'Brien, Rabindra Gautam, Krista Reynolds, Laura S Schmidt, Kristin Choo, Alex Kenigsberg, Sandeep Gurram, Emily Y Chew, Naris Nilubol, Prashant Chittaboina, Maria J Merino, Mark W Ball, W Marston Linehan",2024
Hereditary Pheochromocytoma as a Main Manifestation of von Hippel Lindau Disease (vHL) in Childhood - A Long-term Follow-up of 5 Patients with vHL from One Family.,"Von Hippel-Lindau disease (vHL) is a hereditary, autosomal dominant syndrome manifested by a predisposition to the occurrence of benign and malignant neoplasms. The spectrum of vHL-related neoplasms includes: pheochromocytoma (PHEO), central nervous system and retinal hemangioblastomas, renal clear cell carcinoma, epididymal cystadenomas, pancreatic neuroendocrine tumors as well as visceral (renal and pancreatic) cysts. We report the family (5 patients) with genetically confirmed vHL in which every member had PHEO diagnosed during pediatric care. The presented family had a missense variant in the <i>VHL</i> gene (ex1 g.A451G gene, p. S80G) which is connected with an increased risk of PHEO. Performing screening laboratory and imaging tests in patients with genetically confirmed vHL disease can help to avoid the occurrence of disease symptoms and to perform an elective surgery in safe conditions. Due to the risk of coexisting pathologies and the complexity of the disease, patients with vHL require long-term care.","Katarzyna Pasternak-Pietrzak, Agata Kozłowska, Elżbieta Moszczyńska",2024
Belzutifan Efficacy and Tolerability in Patients with Sporadic Metastatic Clear Cell Renal Cell Carcinoma.,"Belzutifan, a hypoxia-inducible factor 2 alpha inhibitor, was approved initially for patients with von Hippel-Lindau disease and more recently for sporadic, metastatic clear cell renal cell carcinoma (ccRCC) based on the results of LITESPARK-005. There is a paucity of data regarding real-world experience with belzutifan in patients with sporadic, metastatic ccRCC. This study aims to describe clinical outcomes with belzutifan in patients with sporadic, metastatic ccRCC.","Emily Wang, Eric S Rupe, Sagar S Mukhida, Andrew C Johns, Matthew T Campbell, Amishi Y Shah, Amado J Zurita, Jianjun Gao, Sangeeta Goswami, Eric Jonasch, Pavlos Msaouel, Nizar M Tannir, Andrew W Hahn",2024
"Belzutifan for patients with von Hippel-Lindau disease-associated CNS haemangioblastomas (LITESPARK-004): a multicentre, single-arm, phase 2 study.","The first-in-class hypoxia-inducible factor-2α inhibitor, belzutifan, showed clinically meaningful antitumour activity in von Hippel-Lindau (VHL) disease-associated neoplasms in the ongoing, single-arm, phase 2 LITESPARK-004 study. We aimed to investigate antitumour activity with an additional 16 months of follow-up and present updated results for the subgroup of patients with CNS haemangioblastomas.","Othon Iliopoulos, Ane B Iversen, Vivek Narayan, Benjamin L Maughan, Kathryn E Beckermann, Stephane Oudard, Tobias Else, Jodi K Maranchie, Cynthia Muller Goldberg, Wei Fu, Rodolfo F Perini, Yanfang Liu, W Marston Linehan, Ramaprasad Srinivasan, Eric Jonasch",2024
"Genetics, Pathophysiology, and Current Challenges in Von Hippel-Lindau Disease Therapeutics.","This review article focuses on von Hippel-Lindau (VHL) disease, a rare genetic disorder characterized by the development of tumors and cysts throughout the body. It discusses the following aspects of the disease.","Laura Gómez-Virgilio, Mireya Velazquez-Paniagua, Lucero Cuazozon-Ferrer, Maria-Del-Carmen Silva-Lucero, Andres-Ivan Gutierrez-Malacara, Juan-Ramón Padilla-Mendoza, Jessica Borbolla-Vázquez, Job-Alí Díaz-Hernández, Fausto-Alejandro Jiménez-Orozco, Maria-Del-Carmen Cardenas-Aguayo",2024
Belzutifan in Individuals with von Hippel-Lindau Retinal Hemangioblastomas: Institutional Experience and Review of the Literature.,"The systemic HIF-2 alpha inhibitor, belzutifan, has been approved for use in patients with von Hippel-Lindau disease (VHL)-associated renal cell carcinoma, central nervous system (CNS) hemangioblastomas, and pancreatic neuroendocrine tumors. This drug has also shown promise in controlling VHL retinal hemangioblastomas (RHs), but little work has been published on the use of the drug in this setting.","Farzad Jamshidi, Lola Lozano, Budd Tucker, Jean Andorf, Elliott Sohn, Edwin Stone, Andrew Groves, Yousef Zakharia, H Culver Boldt, Elaine Binkley",2024
Advances in Molecular Mechanisms of Kidney Disease: Integrating Renal Tumorigenesis of Hereditary Cancer Syndrome.,"Renal cell carcinoma (RCC) comprises various histologically distinct subtypes, each characterized by specific genetic alterations, necessitating individualized management and treatment strategies for each subtype. An exhaustive search of the PubMed database was conducted without any filters or restrictions. Inclusion criteria encompassed original English articles focusing on molecular mechanisms of kidney cancer. On the other hand, all non-original articles and articles published in any language other than English were excluded. Hereditary kidney cancer represents 5-8% of all kidney cancer cases and is associated with syndromes such as von Hippel-Lindau syndrome, Birt-Hogg-Dubè syndrome, succinate dehydrogenase-deficient renal cell cancer syndrome, tuberous sclerosis complex, hereditary papillary renal cell carcinoma, fumarate hydratase deficiency syndrome, BAP1 tumor predisposition syndrome, and other uncommon hereditary cancer syndromes. These conditions are characterized by distinct genetic mutations and related extra-renal symptoms. The majority of renal cell carcinoma predispositions stem from loss-of-function mutations in tumor suppressor genes. These mutations promote malignant advancement through the somatic inactivation of the remaining allele. This review aims to elucidate the main molecular mechanisms underlying the pathophysiology of major syndromes associated with renal cell carcinoma. By providing a comprehensive overview, it aims to facilitate early diagnosis and to highlight the principal therapeutic options available.","Rossella Cicchetti, Martina Basconi, Giulio Litterio, Marco Mascitti, Flavia Tamborino, Angelo Orsini, Alessio Digiacomo, Matteo Ferro, Luigi Schips, Michele Marchioni",2024
Unusual Presentation of Von Hippel-Lindau Syndrome With Gastric Variceal Bleeding.,Gastric varices are most commonly a complication of portal hypertension or splenic vein thrombosis (SVT). The presence of gastric varices due to portal hypertension is significantly less than the prevalence of esophageal varices. SVT is a known complication of pancreatitis due to inflammation or compression of the splenic vein coursing along the posterior surface of the pancreas. Occlusion of the splenic vein leads to left-sided portal hypertension. Left-sided portal hypertension results in the development of collateral vessels that bypass the splenic vein by connecting with the short gastric veins. The associated increased pressure within the gastric vessels results in gastric varices. Gastric varices due to SVT may occur in the absence of or be disproportionate to esophageal varices. We report an interesting case of gastrointestinal bleeding from gastric varices related to cirrhosis secondary to metabolic dysfunction-associated steatohepatitis and SVT secondary to chronic pancreatitis due to pancreatic neuroendocrine tumor (NET) in a patient diagnosed with von Hippel-Lindau (VHL) syndrome.,"David W Graham, Blake Thompson, Parvez Mantry",2024
Understanding Adult Central Nervous System Hemangioblastomas: A Systematic Review.,"Adult hemangioblastomas (HBs) are rare World Health Organization central nervous system (CNS) grade 1 tumors, particularly affecting the posterior cranial fossa. They exhibit a gender bias, impacting men in their fifth and sixth decades of life and manifesting sporadically or as part of von Hippel Lindau disease. Understanding the intricacies of CNS HBs is crucial for clinical decision-making.","Dragan Jankovic, Ema Selimovic, Marin Kuharic, Bruno Splavski, Kresimir Rotim, Kenan I Arnautovic",2024
The rare diagnosis of Von Hippel-Lindau disease in a 29-year-old patient.,,"Tryfon Rotsos, Peggy Bouzika, Maria-Evanthia Sotirianakou, Chrysanthos Symeonidis, Ioannis Giachos, Evangelia Papakonstantinou, Theodoros Paraskevopoulos, Ilias Georgalas",2024
Innovative solutions? Belzutifan therapy for hemangioblastomas in Von Hippel-Lindau disease: A systematic review and single-arm meta-analysis.,"Von Hippel-Lindau (VHL) disease is a rare autosomal dominant disorder that predisposes patients to develop multiple cysts and tumors, such as hemangioblastomas (HBs) and clear cell renal cell carcinoma (ccRCC), due to mutations in the VHL tumor suppressor gene. While treatment of HBs varies based on their characteristics and has improved patient survival, it still involves high morbidity and mortality, leading to ongoing debates and studies to refine therapy strategies. Recent developments include the emergence of Belzutifan, a novel inhibitor targeting hypoxia-inducible factor 2α (HIF-2α), which has shown promising results in ongoing trials, particularly for patients not immediately requiring surgery.","Lucca B Palavani, Raphael Camerotte, Bernardo Vieira Nogueira, Márcio Yuri Ferreira, Leonardo B Oliveira, Lucas Pari Mitre, Wilson Coelho Nogueira de Castro, Gisele Lúcia Canto Gomes, Luis F Fabrini Paleare, Sávio Batista, Filipi Fim Andreão, Raphael Bertani, Allan Dias Polverini",2024
Clinical T1a Renal Cell Carcinoma with Solitary Diaphragmatic Metastasis in a Patient with von Hippel-Lindau Disease.,"We report the case of a 38-year-old man with two von Hippel-Lindau disease-associated T1a renal cell carcinomas (RCCs) (<2 cm in diameter) which developed into a 2.5-cm solitary diaphragmatic metastatic tumor. After diagnosis using percutaneous biopsy, the diaphragmatic metastasis and two RCCs were treated by laparoscopic resection and percutaneous cryoablation, respectively. One year after treatment, the patient survived without local recurrence or distant metastasis. This report describes a rare case of RCC metastasis in VHL disease and its treatment.","Tadataka Hirai, Mayu Uka, Toshihiro Iguchi, Kazuya Yasui, Takahiro Kawabata, Noriyuki Umakoshi, Koji Tomita, Yusuke Matsui, Yasuyuki Kobayashi, Motoo Araki, Takao Hiraki",2024
Trigeminal nerve hemangioblastoma in the setting of undiagnosed von Hippel-Lindau disease: illustrative case.,"Von Hippel-Lindau disease (VHL) is an autosomal dominant tumor predisposition syndrome caused by mutations in the VHL gene. Patients with VHL are predisposed to developing numerous neoplasms, including central nervous system hemangioblastomas that typically arise within the cerebellum, brainstem, or spinal cord. The authors present the unusual case of a 69-year-old patient with a hemangioblastoma of the trigeminal nerve as his initial presentation of VHL.","Nisha L Busch, Alejandro Matos Cruz, John Herbst, Kymberly Gyure, Rodney Wegner, Alexander Yu, Matthew J Shepard",2024
Optic nerve and chiasm hemangioblastomas in von Hippel-Lindau disease: report of 12 cases and review of the literature.,"Optic nerve and chiasm hemangioblastomas are rare tumors, occurring sporadically or in the context of von Hippel-Lindau (VHL) disease. They have only been portrayed in isolated case reports and small cohorts. Their natural history and therapeutic strategies are only scarcely described. To better characterize these rare tumors, we retrospectively analyzed an optic nerve and chiasm hemangioblastoma series of 12 VHL patients. By combining our own experience to a review of all known cases in literature, we intended to create treatment recommendations for optic nerve and chiasm hemangioblastomas in VHL patients.","Evelynn Vergauwen, Jan-Helge Klingler, Marie T Krüger, Christine Steiert, Robert Kuijpers, Steffen Rosahl, Anne-Marie Vanbinst, Corina Emilia Andreescu, Sven Gläsker",2024
Portal Venous Thrombosis after Percutaneous Cryoablation for Renal Cell Carcinoma.,"A 50-year-old man with von Hippel-Lindau disease underwent cryoablation (CRA) for two adjacent renal cell carcinomas in the upper pole of his right kidney. Although computed tomography (CT) immediately after CRA revealed involvement of part of the liver parenchyma in the ice-ball, the treatment was completed without complications. Contrast-enhanced CT on day 2 post-CRA revealed a thrombus in the portal vein of segment 6 near the ablated liver parenchyma, prompting the initiation of oral anticoagulation. The patient was discharged on day 4 after CRA without any sequelae, and a follow-up contrast-enhanced CT done 6 weeks later demonstrated resolution of the portal vein thrombus.","Takahiro Kawabata, Toshihiro Iguchi, Yusuke Matsui, Koji Tomita, Mayu Uka, Noriyuki Umakoshi, Takao Hiraki",2024
Single Stage Bilateral Adrenalectomy (Cortical-Sparing) and Pancreatectomy (Corpus-Sparing) in a Patient with Von Hippel-Lindau Disease.,"Von Hippel-Lindau (VHL) disease is an autosomal dominant syndrome and affects many organs. We aim to report an adult patient with VHL disease having bilateral adrenal pheochromocytoma and multiple neuroendocrine tumors of the pancreas who was successfully treated with simultaneous function-preserving adrenalectomy and pancreatectomy. A 27-year-old woman was admitted to hospital with hypertension. The computed tomography of the abdomen revealed a solid tumor in both adrenal glands with the sizes of 12x7 cm on the right and 4x4 cm on the left. She also had two pancreatic solid masses in the head and three in the tail with varying sizes. The laboratory tests are all within normal limits except elevated 24-hour urinary metanephrine and normetanephrine. I-123 MIBG scanning showed increased uptake in both adrenal glands. Fine needle aspiration biopsy of the tumor on head of pancreas via endoscopic ultrasonography showed neuroendocrine tumor. Those findings were compatible with bilateral pheochromocytoma and multiple pancreatic neuroendocrine tumors and genetic tests revealed the mutation which confirmed the diagnosis of VHL disease. After suppression with alpha-1 inhibitor, right total, left cortical-sparing adrenalectomy, Whipple procedure for the pancreatic head lesions and spleen-preserving distal pancreatectomy were performed and pancreatic corpus was preserved. This case showed that multiple function-preserving procedures can be safely performed with oncological principles in patients with VHL disease.","Mehmet Haciyanli, Turan Acar, Oguzhan Ozsay, Nihan Acar, Selda Gucek Haciyanli, Emine Ozlem Gur, Osman Nuri Dilek",2024
Optical Coherence Tomography Angiography-Navigated Laser Photocoagulation of Retinal Hemangioblastomas in Patients With von Hippel-Lindau Disease.,To describe optical coherence tomography angiography (OCTA)-guided navigated laser photocoagulation (LP) using the Navilas Laser System for treating retinal hemangioblastomas (RHs) associated with von Hippel-Lindau disease (VHLD).,"Yannik Laich, Navid Farassat, Viviane Grewing, Daniel Boehringer, Felicitas Bucher, Peter M Maloca, Thomas Reinhard, Stefan J Lang, Hansjuergen Agostini, Michael Reich",2024
