text,chunk_id,title,publication_date,authors,disease
"Systematic Analysis and Insights Into the Mutation Spectrum and Ethnic Differences in ATP7B Mutations Associated With Wilson Disease Wilson disease (WD, OMIM: #277900) is a rare autosomal recessive disorder characterized by impaired metabolism of copper, which causes copper to accumulate and become toxic, affecting the liver and brain among other organs.<sup><xref rid=""bibr1-11772719241297169"" ref-type=""bibr"">1</xref><xref rid=""bibr2-11772719241297169"" ref-type=""bibr""></xref>-<xref",0_0,Systematic Analysis and Insights Into the Mutation Spectrum and Ethnic Differences in ATP7B Mutations Associated With Wilson Disease,4 11 2024,,Wilson_Disease
"ref-type=""bibr""></xref>-<xref rid=""bibr3-11772719241297169"" ref-type=""bibr"">3</xref></sup> The Wilson disease was first described in the year of by Dr. Samuel Alexander Kinnier Wilson, a British neurologist, who observed neurological symptoms and liver disease in affected patients.<sup><xref rid=""bibr1-11772719241297169"" ref-type=""bibr"">1</xref>,<xref rid=""bibr4-11772719241297169"" ref-type=""bibr"">4</xref></sup> Symptoms of WD present in childhood, adolescence or adulthood with a wide range of clinical",0_1,Systematic Analysis and Insights Into the Mutation Spectrum and Ethnic Differences in ATP7B Mutations Associated With Wilson Disease,4 11 2024,,Wilson_Disease
"or adulthood with a wide range of clinical manifestations. A greenish-brown corneal opacity, called as the Kayser-Fleisher ring, has been reported as a key ophthalmologic characteristic presents in WD. Additionally, the accumulation of copper in the liver leads to the damage of cellular, resulting in liver disease. Copper buildup also affects the brain, leading to many neurological diseases, including tremors, dystonia, and mood disorders.<sup><xref rid=""bibr5-11772719241297169""",0_2,Systematic Analysis and Insights Into the Mutation Spectrum and Ethnic Differences in ATP7B Mutations Associated With Wilson Disease,4 11 2024,,Wilson_Disease
"rid=""bibr5-11772719241297169"" ref-type=""bibr"">5</xref>,<xref rid=""bibr6-11772719241297169"" ref-type=""bibr"">6</xref></sup> As the molecular level, the gene of <italic toggle=""yes"">ATP7B</italic> (OMIM: #606882), responsible for Wilson’s disease, was identified by Dr. John H. W. Wason in 1993.<sup>",0_3,Systematic Analysis and Insights Into the Mutation Spectrum and Ethnic Differences in ATP7B Mutations Associated With Wilson Disease,4 11 2024,,Wilson_Disease
"<xref rid=""bibr7-11772719241297169"" ref-type=""bibr"">7</xref>
</sup> The homozygous or compound heterozygous in the coding region and the promoter of <italic toggle=""yes"">ATP7B</italic>, located on chromosome 13q14.3, has been reported to be responsible for this pathology in more than 95% case.<sup><xref rid=""bibr1-11772719241297169"" ref-type=""bibr"">1</xref>,<xref rid=""bibr8-11772719241297169"" ref-type=""bibr"">8</xref>,<xref rid=""bibr9-11772719241297169"" ref-type=""bibr"">9</xref></sup>",0_4,Systematic Analysis and Insights Into the Mutation Spectrum and Ethnic Differences in ATP7B Mutations Associated With Wilson Disease,4 11 2024,,Wilson_Disease
"<italic toggle=""yes"">ATP7B</italic> gene contains 21 exons and 20 introns, and encodes for a 1465-aminoacid protein—a copper-transporting ATPase (Cu-ATPase) across the plasma membrane, which is synthetized in the endoplasmic reticulum and highly located in the trans-Golgi network of hepatocytes.<sup><xref rid=""bibr1-11772719241297169"" ref-type=""bibr"">1</xref>,<xref rid=""bibr3-11772719241297169"" ref-type=""bibr"">3</xref>,<xref rid=""bibr7-11772719241297169"" ref-type=""bibr"">7</xref>,<xref",0_5,Systematic Analysis and Insights Into the Mutation Spectrum and Ethnic Differences in ATP7B Mutations Associated With Wilson Disease,4 11 2024,,Wilson_Disease
"ref-type=""bibr"">7</xref>,<xref rid=""bibr8-11772719241297169"" ref-type=""bibr"">8</xref></sup> The structure of ATP7B protein, are described below, to receive copper ions within the cell, transport them through specific cellular compartments, and ultimately facilitate their incorporation into copper-dependent proteins or their elimination from the cell, maintaining copper homeostasis. ATP7B has a P-type ATPase architecture of conserved domains: a phosphatase domain (A-domain), a phosphorylation domain",0_6,Systematic Analysis and Insights Into the Mutation Spectrum and Ethnic Differences in ATP7B Mutations Associated With Wilson Disease,4 11 2024,,Wilson_Disease
"domain (A-domain), a phosphorylation domain (P-domain), ATP-binding domain (N-domain), and 8 transmembrane domains (M-domain) form an intramembranous Cu channel.<sup><xref rid=""bibr7-11772719241297169"" ref-type=""bibr"">7</xref>,<xref rid=""bibr10-11772719241297169"" ref-type=""bibr"">10</xref>,<xref rid=""bibr11-11772719241297169"" ref-type=""bibr"">11</xref></sup> This multi-domain has the distinctive structural feature: a large cytosolic N-terminal tail that contains 6 70-aa long independently folded Cu (I)",0_7,Systematic Analysis and Insights Into the Mutation Spectrum and Ethnic Differences in ATP7B Mutations Associated With Wilson Disease,4 11 2024,,Wilson_Disease
"contains 6 70-aa long independently folded Cu (I) binding domains (metal binding domains, MBDs, namely MBD1 to MBD6).<sup>",0_8,Systematic Analysis and Insights Into the Mutation Spectrum and Ethnic Differences in ATP7B Mutations Associated With Wilson Disease,4 11 2024,,Wilson_Disease
"<xref rid=""bibr12-11772719241297169"" ref-type=""bibr"">12</xref>
</sup> The function of MBD has been reported as receiving Cu<sup>+</sup> from a cytoplasmic Cu<sup>+</sup> chaperone antioxidant protein 1 and participating in subsequent Cu<sup>+</sup> transport across the membrane.<sup>
<xref rid=""bibr11-11772719241297169"" ref-type=""bibr"">11</xref>",0_9,Systematic Analysis and Insights Into the Mutation Spectrum and Ethnic Differences in ATP7B Mutations Associated With Wilson Disease,4 11 2024,,Wilson_Disease
"</sup> MBDs are found in the N-terminal with MBD1 being the first domain from the N-terminus and MBD6 being the domain nearest to the region of ATP7B that spans the membrane.<sup>
<xref rid=""bibr11-11772719241297169"" ref-type=""bibr"">11</xref>",0_10,Systematic Analysis and Insights Into the Mutation Spectrum and Ethnic Differences in ATP7B Mutations Associated With Wilson Disease,4 11 2024,,Wilson_Disease
"</sup> ATP7B serves a function in the export of copper from cells into bile and delivers copper for the functional synthesis of ceruloplasmin with the energy of ATP hydrolysis.<sup><xref rid=""bibr1-11772719241297169"" ref-type=""bibr"">1</xref>,<xref rid=""bibr2-11772719241297169"" ref-type=""bibr"">2</xref>,<xref rid=""bibr8-11772719241297169"" ref-type=""bibr"">8</xref>,<xref rid=""bibr13-11772719241297169"" ref-type=""bibr"">13</xref></sup> Recent years have seen tremendous progress in our knowledge of characterizing",0_11,Systematic Analysis and Insights Into the Mutation Spectrum and Ethnic Differences in ATP7B Mutations Associated With Wilson Disease,4 11 2024,,Wilson_Disease
"progress in our knowledge of characterizing the mutations of <italic toggle=""yes"">ATP7B</italic> gene related to WD and their effects on protein function. Mutations in the ATP7B gene may impair protein function, leading to copper accumulation in the liver and brain as well as improper ceruloplasmin synthesis.<sup>",0_12,Systematic Analysis and Insights Into the Mutation Spectrum and Ethnic Differences in ATP7B Mutations Associated With Wilson Disease,4 11 2024,,Wilson_Disease
"<xref rid=""bibr14-11772719241297169"" ref-type=""bibr"">14</xref>",0_13,Systematic Analysis and Insights Into the Mutation Spectrum and Ethnic Differences in ATP7B Mutations Associated With Wilson Disease,4 11 2024,,Wilson_Disease
"</sup> Thur far, more than 1,000 variations of ATP7B associated with WD have been reported from various countries (The Human Gene Mutation Database (HGMD<sup>®</sup>). Available at: <ext-link http://www.w3.org/1999/xlink href=""http://www.hgmd.cf.ac.uk/ac/index.php"" ext-link-type=""uri"">http://www.hgmd.cf.ac.uk/ac/index.php</ext-link>, Accessed: 17<sup>th</sup> Dec 2023). Due to the wide-spectrum of phenotypic variations in symptomatology, combined with the rarity of Wilson’s disease, it can lead to",0_14,Systematic Analysis and Insights Into the Mutation Spectrum and Ethnic Differences in ATP7B Mutations Associated With Wilson Disease,4 11 2024,,Wilson_Disease
"the rarity of Wilson’s disease, it can lead to misdiagnosis or delayed diagnosis.<sup>",0_15,Systematic Analysis and Insights Into the Mutation Spectrum and Ethnic Differences in ATP7B Mutations Associated With Wilson Disease,4 11 2024,,Wilson_Disease
"<xref rid=""bibr12-11772719241297169"" ref-type=""bibr"">12</xref>",0_16,Systematic Analysis and Insights Into the Mutation Spectrum and Ethnic Differences in ATP7B Mutations Associated With Wilson Disease,4 11 2024,,Wilson_Disease
"</sup> Promptly identifying the disorder presents, particularly in its early stages when symptoms may be nonspecific, challenges for clinicians. Therefore, for an accurate and timely diagnosis, it becomes essential to combine clinical evaluation, genetic analysis to identify ATP7B mutations, and biochemical testing for copper levels. The purposes of current study is to gain a thorough grasp of the spectrum of genetic variations as well as to consolidate and analyze existing data from various sources,",0_17,Systematic Analysis and Insights Into the Mutation Spectrum and Ethnic Differences in ATP7B Mutations Associated With Wilson Disease,4 11 2024,,Wilson_Disease
"and analyze existing data from various sources, including clinical studies and genetic databases, to identify patterns, prevalence. Overall, understanding the mutation in the ATP7B gene offers insights into the mechanisms behind WD and guides strategies for diagnosis and treatment.   The gene of <italic toggle=""yes"">ATP7B</italic> has been reported to be pivotal in studies of WD related to the metabolism of copper.<sup><xref rid=""bibr1-11772719241297169"" ref-type=""bibr"">1</xref>,<xref",0_18,Systematic Analysis and Insights Into the Mutation Spectrum and Ethnic Differences in ATP7B Mutations Associated With Wilson Disease,4 11 2024,,Wilson_Disease
"ref-type=""bibr"">1</xref>,<xref rid=""bibr12-11772719241297169"" ref-type=""bibr"">12</xref>,<xref rid=""bibr14-11772719241297169"" ref-type=""bibr"">14</xref>,<xref rid=""bibr26-11772719241297169"" ref-type=""bibr"">26</xref></sup> This study comprehensively highlighted the mutation of <italic toggle=""yes"">ATP7B</italic> in WD patients by an analysis of 40 studies from 2001 to 2023. According our systematic analysis, various mutations, notably more than 50% described single nucleotide variations, dispersed among the",0_19,Systematic Analysis and Insights Into the Mutation Spectrum and Ethnic Differences in ATP7B Mutations Associated With Wilson Disease,4 11 2024,,Wilson_Disease
"single nucleotide variations, dispersed among the gene’s 21 exons, were identified. Most detected variants were located in crucial regions such as the transmembrane domain, metal-binding domains, and ATP-binding site, highlighting their potential impact on the gene’s function and the progression of Wilson disease. The mutation profile of previous studies highly presented most of our identified variants located on the exon 8, which exhibited the highest mutation diversity, 18 studies identified 53 distinct",0_20,Systematic Analysis and Insights Into the Mutation Spectrum and Ethnic Differences in ATP7B Mutations Associated With Wilson Disease,4 11 2024,,Wilson_Disease
"diversity, 18 studies identified 53 distinct variants, predominantly missense mutations (81.13%), followed by exons 18, 2, and 14, with exon 1 showing the least variability. Exon 8 encodes part of the transmembrane domain 4 (Tm4) of the ATP7B protein.<sup>",0_21,Systematic Analysis and Insights Into the Mutation Spectrum and Ethnic Differences in ATP7B Mutations Associated With Wilson Disease,4 11 2024,,Wilson_Disease
"<xref rid=""bibr9-11772719241297169"" ref-type=""bibr"">9</xref>",0_22,Systematic Analysis and Insights Into the Mutation Spectrum and Ethnic Differences in ATP7B Mutations Associated With Wilson Disease,4 11 2024,,Wilson_Disease
"</sup> Tm4 spans the cellular membrane, allowing the protein to embed within the lipid bilayer and form a pathway for copper ion transport. The transmembrane domains are essential for the function of ATP7B protein in moving copper ions across cellular membranes. Therefore, mutations occurred in exon 8 can disrupt the structure of the Tm4 domain, impairing the ability to effectively transport copper of ATP7B protein, resulting in the clinical manifestations of Wilson disease. Focusing on exon 8, which",0_23,Systematic Analysis and Insights Into the Mutation Spectrum and Ethnic Differences in ATP7B Mutations Associated With Wilson Disease,4 11 2024,,Wilson_Disease
"of Wilson disease. Focusing on exon 8, which exhibited the highest mutation diversity, 18 studies identified 53 distinct variants, predominantly missense mutations, which constituted 81.13% (43 out of 53 cases). Other notable types included frame-shift, silent, and non-sense mutations. These figures underscore the predominance of missense mutations and the relative rarity of other mutation types in exon 8. In this study, we pointed out the notably frequent variants of as c.2333G>A/T (p.R778Q/L), c.2305A>G",0_24,Systematic Analysis and Insights Into the Mutation Spectrum and Ethnic Differences in ATP7B Mutations Associated With Wilson Disease,4 11 2024,,Wilson_Disease
"variants of as c.2333G>A/T (p.R778Q/L), c.2305A>G (p.M769V), c.2336G>A (p.W779*), and c.2304dupC (p.M769HfsX26) being reported in different populations, with notable prevalences in China, India, France, and Western countries. Based on the calculation of weighted mean of variants’ proportion, the pooled estimate of these percentages of 14.19% for c.2333G>A/T (p.R778Q/L), 2.70% for c.2305A>G (p.M769V), 1.42% for c.2336G>A (p.W779*), and 2.33% for c.2304dupC (p.M769HfsX26), provided critical insights into the",0_25,Systematic Analysis and Insights Into the Mutation Spectrum and Ethnic Differences in ATP7B Mutations Associated With Wilson Disease,4 11 2024,,Wilson_Disease
"provided critical insights into the prevalence and impact of exon 8 mutations. Understanding these proportions is vital for grasping the broader implications across diverse populations and study settings, emphasizing the importance of exon 8 in genetic studies related to Wilson Disease. Therefore, the critical nature of exon 8 mutations is further emphasized by their relevance in diagnosing hepatic failure diseases, particularly Wilson Disease. The method of DNA extraction and Polymerase Chain Reaction",0_26,Systematic Analysis and Insights Into the Mutation Spectrum and Ethnic Differences in ATP7B Mutations Associated With Wilson Disease,4 11 2024,,Wilson_Disease
"of DNA extraction and Polymerase Chain Reaction (PCR) sequencing were widely used to identify these mutations. This technique amplifies specific DNA sequences, making it possible to detect even minor genetic variations with high precision. The significance of mutation types has been reported that it can be used as the element for WD prognosis, as well as influence response to treatment of WD in some cases. Notably, the correlation between the mutations of <italic toggle=""yes"">ATP7B</italic> gene and",0_27,Systematic Analysis and Insights Into the Mutation Spectrum and Ethnic Differences in ATP7B Mutations Associated With Wilson Disease,4 11 2024,,Wilson_Disease
"of <italic toggle=""yes"">ATP7B</italic> gene and clinical parameters has a few reports, and also remains controversial.<sup>",0_28,Systematic Analysis and Insights Into the Mutation Spectrum and Ethnic Differences in ATP7B Mutations Associated With Wilson Disease,4 11 2024,,Wilson_Disease
"<xref rid=""bibr34-11772719241297169"" ref-type=""bibr"">34</xref>",0_29,Systematic Analysis and Insights Into the Mutation Spectrum and Ethnic Differences in ATP7B Mutations Associated With Wilson Disease,4 11 2024,,Wilson_Disease
"</sup> This is how studies are biased. Despite extensive research, studies have yielded inconsistent results regarding how specific mutations influence disease onset, severity, and progression. This controversy arises from several factors, including the genetic diversity across different populations, which can affect mutation prevalence and clinical expression. WD patients, who presented a phenotype of chronic liver disease, on chelation therapy, and carried at least one loss-of-function variant in the",0_30,Systematic Analysis and Insights Into the Mutation Spectrum and Ethnic Differences in ATP7B Mutations Associated With Wilson Disease,4 11 2024,,Wilson_Disease
"at least one loss-of-function variant in the <italic toggle=""yes"">ATP7B</italic> gene, tended to display a worse prognosis during long-term follow-up.<sup>",0_31,Systematic Analysis and Insights Into the Mutation Spectrum and Ethnic Differences in ATP7B Mutations Associated With Wilson Disease,4 11 2024,,Wilson_Disease
"<xref rid=""bibr36-11772719241297169"" ref-type=""bibr"">36</xref>
</sup> This pointed out the importance of identifying genetic mutations of <italic toggle=""yes"">ATP7B</italic> gene in WD patients with hepatic involvement to better predict the progression of disease as well as diagnose the WD. The p.R778L mutation in Chinese population was associated with liver types, and some studies have no significant association between the p.R778L mutation and clinical type, sex, age.<sup>",0_32,Systematic Analysis and Insights Into the Mutation Spectrum and Ethnic Differences in ATP7B Mutations Associated With Wilson Disease,4 11 2024,,Wilson_Disease
"<xref rid=""bibr37-11772719241297169"" ref-type=""bibr"">37</xref>
</sup> One of the best known examples of the genotype-phenotype correlation in WD patients is the p.H1609Q mutation in East German patients with WD.<sup>
<xref rid=""bibr20-11772719241297169"" ref-type=""bibr"">20</xref>",0_33,Systematic Analysis and Insights Into the Mutation Spectrum and Ethnic Differences in ATP7B Mutations Associated With Wilson Disease,4 11 2024,,Wilson_Disease
"</sup> In their study, patients carried the homozygous mutation of p.H1609Q have symptoms started later than compound heterozygous mutation or no mutation. Moreover, they displayed more frequently neurologic symptoms and Kayser-Fleischer rings. The status of mutation did not significantly correlate with liver biopsy findings, serum ceruloplasmin levels or Cu-assay results. Molecular therapies of WD targeting molecular interactions to the mutant protein ATP7B have been studied. For instance, the p.H1609Q",0_34,Systematic Analysis and Insights Into the Mutation Spectrum and Ethnic Differences in ATP7B Mutations Associated With Wilson Disease,4 11 2024,,Wilson_Disease
"have been studied. For instance, the p.H1609Q mutation was reported promoting the interaction between ATP7B and HSP70, resulting in the mutant promoted the accumulation of the endoplasmic reticulum degradation of mutant ATP7B protein led to the copper accelerating in hepatic cells. Domperidone is an HSP70 inhibitor that effectively counteracts the beginning of WD by enhancing the trafficking and function of ATP7B–H1069Q by preventing its access to the HSP70 proteostasis network.<sup>",0_35,Systematic Analysis and Insights Into the Mutation Spectrum and Ethnic Differences in ATP7B Mutations Associated With Wilson Disease,4 11 2024,,Wilson_Disease
"<xref rid=""bibr38-11772719241297169"" ref-type=""bibr"">38</xref>
</sup> Tang et al (2023) developed a WD cell model within a p.R778L mutation. Importantly, they reported that both necroptosis and autophagy are critically involved to the pathogenesis of WD. In this model of a p.R778L mutation, ULK1- and ATG16L1-mediated autophagy inhibits RIPK3- and MLKL-mediated necroptosis.<sup>
<xref rid=""bibr39-11772719241297169"" ref-type=""bibr"">39</xref>",0_36,Systematic Analysis and Insights Into the Mutation Spectrum and Ethnic Differences in ATP7B Mutations Associated With Wilson Disease,4 11 2024,,Wilson_Disease
"</sup> Their finding suggested that the possibility of mutation-specific treatment approaches, in which patients with specific ATP7B mutations, such p.R778L, might benefit from targeting processes like autophagy. The strength of our study focused on the comprehensive approach to analyze the mutations dispersed among the gene’s 21 exons across previous multiple studies. By utilizing a methodical screening procedure, noteworthy patterns and rates of mutations were detected, guaranteeing a comprehensive",0_37,Systematic Analysis and Insights Into the Mutation Spectrum and Ethnic Differences in ATP7B Mutations Associated With Wilson Disease,4 11 2024,,Wilson_Disease
"were detected, guaranteeing a comprehensive comprehension of their frequency and therapeutic consequences. Additionally, the application of a random effects model in our meta-analysis allowed us to account for heterogeneity among studies, providing more accurate pooled estimates. The lack of publication bias, confirmed through Egger’s test, further strengthens the validity of our results. Overall, our study offers a robust and detailed examination of exon 8 mutations, contributing valuable insights to the",0_38,Systematic Analysis and Insights Into the Mutation Spectrum and Ethnic Differences in ATP7B Mutations Associated With Wilson Disease,4 11 2024,,Wilson_Disease
"mutations, contributing valuable insights to the field of genetic research on Wilson Disease. However, the limitation of current study, the heterogeneity among the included studies, which may have impacted the accuracy of the pooled estimates. The results’ applicability to different ethnic populations may be limited by the omission of articles written in languages other than English. Subtle biases in research selection or mutation nomenclature may still exist, despite efforts to assess publication bias",0_39,Systematic Analysis and Insights Into the Mutation Spectrum and Ethnic Differences in ATP7B Mutations Associated With Wilson Disease,4 11 2024,,Wilson_Disease
"exist, despite efforts to assess publication bias having been made. In current study, the results of our comprehensive analyzing presented the knowledge of mutations, especially in exon 8, functioned as the transmembrane domain, occurred on <italic toggle=""yes"">ATP7B</italic>. Consequently, the variations of c.2333G>A/T (p.R778Q/L), c.2305A>G (p.M769V), c.2336G>A (p.W779*), and c.2304dupC (p.M769HfsX26) as hotspot mutations on exon 8 for the present study.",0_40,Systematic Analysis and Insights Into the Mutation Spectrum and Ethnic Differences in ATP7B Mutations Associated With Wilson Disease,4 11 2024,,Wilson_Disease
"Contrast-enhanced ultrasound findings of sclerotic nodules in Wilson disease: A case report Wilson disease, also known as hepatolenticular degeneration, is an autosomal recessive genetic disease found by Samuel Alexander Kinnier Wilson and prevalent in childhood and adolescents.<sup>[<xref rid=""R1"" ref-type=""bibr"">1</xref>,<xref rid=""R2"" ref-type=""bibr"">2</xref>]</sup> Its clinical manifestations are complex and diverse, with liver damage, neuropsychiatric dysfunction, Kayser-Fleischer (K-F) rings, and",1_0,Contrast-enhanced ultrasound findings of sclerotic nodules in Wilson disease: A case report,18 10 2024,,Wilson_Disease
"dysfunction, Kayser-Fleischer (K-F) rings, and kidney damage as the main manifestations.<sup>[<xref rid=""R3"" ref-type=""bibr"">3</xref>]</sup> After reasonable treatment, the prognosis of Wilson disease is good, but it is often delayed due to untimely diagnosis, resulting in a poor prognosis.<sup>[<xref rid=""R4"" ref-type=""bibr"">4</xref>]</sup> Here, through this case report, we found that contrast-enhanced ultrasound (CEUS) has a certain value in the diagnosis of this kind of disease, suggesting that this",1_1,Contrast-enhanced ultrasound findings of sclerotic nodules in Wilson disease: A case report,18 10 2024,,Wilson_Disease
"of this kind of disease, suggesting that this imaging manifestation is likely to become the theoretical basis for the diagnosis of Wilson disease. An 18-year-old female patient was admitted to the Department of Hepatobiliary surgery of our hospital because she found that the number of 3 blood cells decreased for >10 days. When she was admitted to the hospital, she mainly carried a summary of the discharge from the people’s Hospital of Qichun. After careful physical examination, it was found that the",1_2,Contrast-enhanced ultrasound findings of sclerotic nodules in Wilson disease: A case report,18 10 2024,,Wilson_Disease
"physical examination, it was found that the hemogram of the patient was slightly poor, the skin was not yellow, the liver and palm was mild, the transverse finger under the liver ribs was 2 fingers, the spleen was enlarged, the boundary was located at the navel level, there was no percussion pain in the liver and spleen area, and the mobility dullness was negative. In the past, she underwent appendicitis surgery at the age of 8, had a history of thrombocytopenic purpura, denied a history of hepatitis B,",1_3,Contrast-enhanced ultrasound findings of sclerotic nodules in Wilson disease: A case report,18 10 2024,,Wilson_Disease
