text,chunk_id,title,publication_date,authors,disease
"showing no restriction on DWI and corresponding high signal in ADC, and no blooming noted at GRE sequences. The above features suggested the lesion to be an arachnoid cyst, which seems to communicate with the greater wing of the left sphenoid bone, as shown in <xref rid=""fig0001"" ref-type=""fig"">Fig. 1</xref>, <xref rid=""fig0002"" ref-type=""fig"">Fig. 2</xref>, <xref rid=""fig0003"" ref-type=""fig"">Fig. 3</xref>.<fig id=""fig0001""><label>Fig. 1</label><caption><p>MRI brain axial images of Fluid attenuation",9_6,Nontraumatic intra-diploic arachnoid cyst communicating with sphenoid bone and in close proximity to cavernous sinus in a known case of Wilson disease: A rare entity,21 8 2024,,Wilson_Disease
"brain axial images of Fluid attenuation inversion recovery sequence (A), T2 weighted imaging (B), T1 weighted imaging (C), and Diffusion Weighted Imaging (D) showing an intra-diploic lesion measuring approximately 14 × 7 mm adjacent to the left cavernous sinus, which appears isointense to CSF on T2WI, hypo to isointense to CSF on T1WI/FLAIR, and no restricted diffusion on DWI.</p></caption><alt-text id=""alt0001"">Fig 1:</alt-text><graphic http://www.w3.org/1999/xlink href=""gr1""",9_7,Nontraumatic intra-diploic arachnoid cyst communicating with sphenoid bone and in close proximity to cavernous sinus in a known case of Wilson disease: A rare entity,21 8 2024,,Wilson_Disease
"http://www.w3.org/1999/xlink href=""gr1"" id=""celink0001""></graphic></fig><fig id=""fig0002""><label>Fig. 2</label><caption><p>MRI brain sagittal image T2 weighted imaging (A-C) showing an intra-diploic lesion measuring approximately 14 × 7 mm adjacent to the left cavernous sinus, which appears isointense to CSF.</p></caption><alt-text id=""alt0002"">Fig 2:</alt-text><graphic http://www.w3.org/1999/xlink href=""gr2"" id=""celink0002""></graphic></fig><fig id=""fig0003""><label>Fig. 3</label><caption><p>MRI brain",9_8,Nontraumatic intra-diploic arachnoid cyst communicating with sphenoid bone and in close proximity to cavernous sinus in a known case of Wilson disease: A rare entity,21 8 2024,,Wilson_Disease
"3</label><caption><p>MRI brain coronal image T2 weighted imaging (A) and (B) showing an intra-diploic lesion measuring approximately 14 × 7 mm adjacent to the left cavernous sinus, which appears isointense to CSF and is noted communicating with the greater wing of the left sphenoid bone.</p></caption><alt-text id=""alt0003"">Fig 3:</alt-text><graphic http://www.w3.org/1999/xlink href=""gr3"" id=""celink0003""></graphic></fig> Arachnoid cysts are benign and appear as cerebrospinal fluid (CSF) filled cystic",9_9,Nontraumatic intra-diploic arachnoid cyst communicating with sphenoid bone and in close proximity to cavernous sinus in a known case of Wilson disease: A rare entity,21 8 2024,,Wilson_Disease
"appear as cerebrospinal fluid (CSF) filled cystic structures [<xref rid=""bib0004"" ref-type=""bibr"">4</xref>,<xref rid=""bib0005"" ref-type=""bibr"">5</xref>]. These cysts are most seen in the middle cranial fossa and may be symptomatic [<xref rid=""bib0006"" ref-type=""bibr"">6</xref>]. They are mostly formed because of traumatic insult to the head, the occipital region being the most common location [<xref rid=""bib0007"" ref-type=""bibr"">[7]</xref>, <xref rid=""bib0008"" ref-type=""bibr"">[8]</xref>, <xref rid=""bib0009""",9_10,Nontraumatic intra-diploic arachnoid cyst communicating with sphenoid bone and in close proximity to cavernous sinus in a known case of Wilson disease: A rare entity,21 8 2024,,Wilson_Disease
"ref-type=""bibr"">[8]</xref>, <xref rid=""bib0009"" ref-type=""bibr"">[9]</xref>], and rarely are they present without a traumatic history. Intra-diploic arachnoid cyst is a very rare entity and may remain asymptomatic for a very long time. These cysts may cause diagnostic challenges, and radiological investigations like computed tomography and magnetic resonance imaging are a great support. To avoid any misinterpretation in diagnosing it, radiologic and clinicopathologic knowledge about the disease is",9_11,Nontraumatic intra-diploic arachnoid cyst communicating with sphenoid bone and in close proximity to cavernous sinus in a known case of Wilson disease: A rare entity,21 8 2024,,Wilson_Disease
"clinicopathologic knowledge about the disease is important. Arachnoid cysts are CSF filled cystic structures within the arachnoid layer, lined by collagen and arachnoidal cells. Its pathogenesis is still not completely clear due to its extremely rare incidence. They can be present at birth due to some congenital malformation in the early gestational life and are termed primary. These malformations can be caused due to abnormality in the drainage of CSF due to venous dysplasia or agenesis. These cysts may",9_12,Nontraumatic intra-diploic arachnoid cyst communicating with sphenoid bone and in close proximity to cavernous sinus in a known case of Wilson disease: A rare entity,21 8 2024,,Wilson_Disease
"to venous dysplasia or agenesis. These cysts may later grow due to secretion by the cells lining the cyst, unidirectional action of the valves or movement of liquid secondary to the vein pulsations [<xref rid=""bib0005"" ref-type=""bibr"">5</xref>]. There is no association of the arachnoid cyst with any disease in particular and has not been described in the recent literature. Its association with the Wilson disease has not been previously described in the recent literature. Secondary arachnoid cysts develop",9_13,Nontraumatic intra-diploic arachnoid cyst communicating with sphenoid bone and in close proximity to cavernous sinus in a known case of Wilson disease: A rare entity,21 8 2024,,Wilson_Disease
"literature. Secondary arachnoid cysts develop mostly due to trauma. Traumatic insult to the head may cause bony defects and fractures. In these bony defects, arachnoid villi may extend, forming an intra-osseous cyst [<xref rid=""bib0009"" ref-type=""bibr"">9</xref>,<xref rid=""bib0010"" ref-type=""bibr"">10</xref>]. Leptomeningeal cysts and CSF fistula are other synonyms for post-traumatic arachnoid cysts [<xref rid=""bib0010"" ref-type=""bibr"">[10]</xref>, <xref rid=""bib0011"" ref-type=""bibr"">[11]</xref>, <xref",9_14,Nontraumatic intra-diploic arachnoid cyst communicating with sphenoid bone and in close proximity to cavernous sinus in a known case of Wilson disease: A rare entity,21 8 2024,,Wilson_Disease
"rid=""bib0011"" ref-type=""bibr"">[11]</xref>, <xref rid=""bib0012"" ref-type=""bibr"">[12]</xref>]. Nontraumatic intra-diploic cysts are very rare and mostly are seen in the occipital region and rarely in temporal or frontal regions [<xref rid=""bib0008"" ref-type=""bibr"">8</xref>,<xref rid=""bib0010"" ref-type=""bibr"">10</xref>,<xref rid=""bib0011"" ref-type=""bibr"">11</xref>]. The size and location of the cyst determine the severity of the signs and symptoms. Symptoms may include bulging of the head, raised intracranial",9_15,Nontraumatic intra-diploic arachnoid cyst communicating with sphenoid bone and in close proximity to cavernous sinus in a known case of Wilson disease: A rare entity,21 8 2024,,Wilson_Disease
"include bulging of the head, raised intracranial pressure, neurological defects, seizures, endocrine disorders, and psychomotor distortion. It is important to rule out various differentials for the arachnoid cyst for which MRI plays a major role. As in the case of the epidermoid cyst, the cystic lesion appears isointense to CSF in both T1WI AND T2WI but hyperintense to CSF on FLAIR and shows restriction on DWI [<xref rid=""bib0013"" ref-type=""bibr"">13</xref>]. Neuroglial cyst follows CSF signal intensity on",9_16,Nontraumatic intra-diploic arachnoid cyst communicating with sphenoid bone and in close proximity to cavernous sinus in a known case of Wilson disease: A rare entity,21 8 2024,,Wilson_Disease
"Neuroglial cyst follows CSF signal intensity on all sequences, as in the case of arachnoid cysts, but these are present in the white matter of the brain [<xref rid=""bib0014"" ref-type=""bibr"">14</xref>]. Other differentials may include subdural hygroma, which may appear isointense to CSF on T1WI and T2WI but hyperintense to CSF on the FLAIR sequence. Hemangioblastoma, pilocytic astrocytoma, etc., might mimic arachnoid cysts [<xref rid=""bib0015"" ref-type=""bibr"">15</xref>]. Asymptomatic arachnoid cysts do not",9_17,Nontraumatic intra-diploic arachnoid cyst communicating with sphenoid bone and in close proximity to cavernous sinus in a known case of Wilson disease: A rare entity,21 8 2024,,Wilson_Disease
"Asymptomatic arachnoid cysts do not need any management. Once the symptoms start to develop, these cysts must be excavated by a surgical approach, which includes marsupialization or fenestration through endoscopic or microscopic techniques or excision of the cyst [<xref rid=""bib0005"" ref-type=""bibr"">5</xref>]. Arachnoid cysts may be due to traumatic and nontraumatic causes. In the presented case, the arachnoid cyst is present at a very rare location and in close proximity to the cavernous sinus. Unusual",9_18,Nontraumatic intra-diploic arachnoid cyst communicating with sphenoid bone and in close proximity to cavernous sinus in a known case of Wilson disease: A rare entity,21 8 2024,,Wilson_Disease
close proximity to the cavernous sinus. Unusual location and low incidence may lead to misdiagnosis of the cyst. Proper clinical and radiological knowledge is of utmost importance in the diagnosis of the lesion and in differentiating it from other such lesions. An informed verbal and written consent were obtained from the patient.,9_19,Nontraumatic intra-diploic arachnoid cyst communicating with sphenoid bone and in close proximity to cavernous sinus in a known case of Wilson disease: A rare entity,21 8 2024,,Wilson_Disease
"Wilson disease (novel <italic toggle=""yes"">ATP7B</italic> variants) with concomitant <italic toggle=""yes"">FLNC</italic>-related cardiomyopathy We report a case of Wilson disease (WD) with dilated cardiomyopathy in which whole-genome sequencing (WGS) revealed the rare co-occurrence of two novel compound heterozygous <italic toggle=""yes"">ATP7B</italic> pathogenic variants (NM_001005918.3:c.2250del/p.N751Tfs*9 and c.3496C>T/p.L1166F) and a known FLNC pathogenic variant. Our results highlight the usefulness of",10_0,"Wilson disease (novel <italic toggle=""yes"">ATP7B</italic> variants) with concomitant <italic toggle=""yes"">FLNC</italic>-related cardiomyopathy",29 8 2024,,Wilson_Disease
"variant. Our results highlight the usefulness of WGS, even in the diagnosis of well-characterized genetic diseases such as WD. The relevant data from this Data Report are hosted at the Human Genome Variation Database at 10.6084/m9.figshare.hgv.3403, 10.6084/m9.figshare.hgv.3406, 10.6084/m9.figshare.hgv.3409",10_1,"Wilson disease (novel <italic toggle=""yes"">ATP7B</italic> variants) with concomitant <italic toggle=""yes"">FLNC</italic>-related cardiomyopathy",29 8 2024,,Wilson_Disease
"Macrothrombocytopenia with leukocyte inclusions in a patient with Wilson disease: a case report and literature review Wilson disease (WD) is an autosomal recessive disorder resulting from <italic toggle=""yes"">ATP7B</italic> gene dysfunction due to mutation, leading to copper accumulation in various tissues, primarily in the liver and brain [<xref ref-type=""bibr"" rid=""CR1"">1</xref>]. The spectrum of manifestations varies, encompassing liver cirrhosis, brain neuronal degeneration, Kayser–Fleischer (K-F) rings",11_0,Macrothrombocytopenia with leukocyte inclusions in a patient with Wilson disease: a case report and literature review,17 7 2024,,Wilson_Disease
"degeneration, Kayser–Fleischer (K-F) rings in the corneal limbus, kidney damage, and hemolytic anemia [<xref ref-type=""bibr"" rid=""CR2"">2</xref>–<xref ref-type=""bibr"" rid=""CR4"">4</xref>]. WD is often misdiagnosed because of the diverse clinical presentations. In this study, we present a case of a middle-aged woman exhibiting thrombocytopenia, giant platelets, and Döhle-like cytoplasmic inclusions in leukocytes. Whole-exome sequencing (WES) revealed a heterozygous <italic toggle=""yes"">ATP7B</italic> gene",11_1,Macrothrombocytopenia with leukocyte inclusions in a patient with Wilson disease: a case report and literature review,17 7 2024,,Wilson_Disease
"<italic toggle=""yes"">ATP7B</italic> gene mutation. Two years after this finding, the patient developed hand tremors, lower limb stiffness, and foreign body sensation in the eyes. We questioned whether these symptoms were associated with WD. To explore this possibility further, we performed copper metabolism analysis, slit-lamp examination, magnetic resonance imaging (MRI), transmission electron microscopy (TEM) observation, and leukocyte copper content detection. In June 2021, a 48-year-old woman presented",11_2,Macrothrombocytopenia with leukocyte inclusions in a patient with Wilson disease: a case report and literature review,17 7 2024,,Wilson_Disease
"In June 2021, a 48-year-old woman presented at our hospital with a 2-year history of easy bruising. Complete blood counts were normal; however, thrombocytopenia was observed (white blood cell count: 3.88 × 10<sup>9</sup>/L; red blood cell count: 3.80 × 10<sup>12</sup>/L; hemoglobin: 115 g/L; platelet count: 65 × 10<sup>9</sup>/L). Other laboratory parameters, including antiplatelet and antinuclear antibodies, thromboaggregation function, von Willebrand factor antigens, prothrombin time, and activated",11_3,Macrothrombocytopenia with leukocyte inclusions in a patient with Wilson disease: a case report and literature review,17 7 2024,,Wilson_Disease
"factor antigens, prothrombin time, and activated partial thromboplastin time, were within normal limits. Liver function test results were mainly normal, except for reduced albumin levels (37.84 g/L; normal range: 40.0–55.0 g/L). Peripheral blood smear revealed thrombocytopenia, with large and giant platelets and Döhle-like cytoplasmic inclusions in the leukocytes. Bone marrow smears showed easily observable Döhle-like cytoplasmic inclusions in neutrophils and megakaryocytes, with degenerative cells being",11_4,Macrothrombocytopenia with leukocyte inclusions in a patient with Wilson disease: a case report and literature review,17 7 2024,,Wilson_Disease
"and megakaryocytes, with degenerative cells being common (Fig. <xref rid=""Fig1"" ref-type=""fig"">1</xref>). Initially, the May–Hegglin anomaly (MHA) was provisionally diagnosed. However, WES showed no mutation in the <italic toggle=""yes"">MYH9</italic> gene but indicated a heterozygous mutation in the twelfth exon of the <italic toggle=""yes"">ATP7B</italic> gene (C.2804 C > T, p.T935M), altering threonine at codon 935 to methionine. The vatiant was verified by Sanger sequencing (Fig. <xref rid=""Fig2""",11_5,Macrothrombocytopenia with leukocyte inclusions in a patient with Wilson disease: a case report and literature review,17 7 2024,,Wilson_Disease
"by Sanger sequencing (Fig. <xref rid=""Fig2"" ref-type=""fig"">2</xref>). This variant is a hotspot mutation in <italic toggle=""yes"">ATP7B</italic>. However, the patient lacked typical WD symptoms, so a diagnosis of WD was not made at that time. Dexamethasone therapy (10 mg/dose, tid, p.o) was initiated but showed a poor response, with platelet counts fluctuating within the range 62–68 × 10<sup>9</sup>/L. No further treatment was administered.",11_6,Macrothrombocytopenia with leukocyte inclusions in a patient with Wilson disease: a case report and literature review,17 7 2024,,Wilson_Disease
"<fig id=""Fig1""><label>Fig. 1</label><caption><p>Peripheral blood and bone marrow smears of the patient. (<bold>A</bold>) Larger platelet (yellow arrow) and Döhle-like cytoplasmic inclusion (red arrow) in neutrophils on the peripheral blood smear. (<bold>B</bold>) Giant platelet (blue arrow) on the peripheral blood smear. (<bold>C</bold>) Döhle-like cytoplasmic inclusions in neutrophils (red arrow) on the bone marrow smear. (<bold>D</bold>) Döhle-like cytoplasmic inclusions in a megakaryocyte (red arrow) on",11_7,Macrothrombocytopenia with leukocyte inclusions in a patient with Wilson disease: a case report and literature review,17 7 2024,,Wilson_Disease
"inclusions in a megakaryocyte (red arrow) on the bone marrow smear (Wright’s stain, ×400, all)</p></caption><graphic http://www.w3.org/1999/xlink href=""12920_2024_1960_Fig1_HTML"" id=""d33e308""></graphic></fig>",11_8,Macrothrombocytopenia with leukocyte inclusions in a patient with Wilson disease: a case report and literature review,17 7 2024,,Wilson_Disease
"<fig id=""Fig2""><label>Fig. 2</label><caption><p>Sequence chromatogram showing the heterozygous nucleotide sequence of c.2840 C > T. Red arrow indicates the mutation site</p></caption><graphic http://www.w3.org/1999/xlink href=""12920_2024_1960_Fig2_HTML"" id=""d33e318""></graphic></fig>",11_9,Macrothrombocytopenia with leukocyte inclusions in a patient with Wilson disease: a case report and literature review,17 7 2024,,Wilson_Disease
"In March 2023, the patient returned to our hospital with extremity ecchymosis, hand tremors, lower limb stiffness, and foreign body sensation in the eyes. Automatic blood cell analysis revealed a platelet count of 46 × 10<sup>9</sup>/L. Peripheral blood and bone marrow smears were similar to those from two years prior. Copper metabolism assessment showed serum ceruloplasmin, serum copper, and 24-hour urine copper levels of 23 (normal range: 25–45) mg/dL, 1161.4 (normal range: 800.0–1550.0) µg/L, and 21.1",11_10,Macrothrombocytopenia with leukocyte inclusions in a patient with Wilson disease: a case report and literature review,17 7 2024,,Wilson_Disease
"(normal range: 800.0–1550.0) µg/L, and 21.1 (normal range: 15.0–60.0) µg/24 h, respectively. Liver function tests indicated decreased albumin levels (35.97 g/L; normal range: 40.00–55.00 g/L). Brain MRI displayed minimal T1W1 low-intensity signal and T2W1 high-intensity signal in both ventricular anterior corners. Abdominal MRI showed multiple liver nodules with prolonged T1 and T2 signals. Slit-lamp examination revealed K-F rings in the corneal limbus (Fig. <xref rid=""Fig3"" ref-type=""fig"">3</xref>A). TEM",11_11,Macrothrombocytopenia with leukocyte inclusions in a patient with Wilson disease: a case report and literature review,17 7 2024,,Wilson_Disease
"rid=""Fig3"" ref-type=""fig"">3</xref>A). TEM showed abundant α particles and dense particles in the giant platelets, along with irregularly expanded and fuzzy inclusion bodies (mitochondria) with broken cristae in leukocytes (Fig. <xref rid=""Fig3"" ref-type=""fig"">3</xref>B).",11_12,Macrothrombocytopenia with leukocyte inclusions in a patient with Wilson disease: a case report and literature review,17 7 2024,,Wilson_Disease
"<fig id=""Fig3""><label>Fig. 3</label><caption><p>(<bold>A</bold>) Brown-spotted, arc-shaped copper deposits observed in the corneal limbus (red arrow). (<bold>B</bold>) Large platelets with adequate α granules and dense particles observed via Transmission electron microscopy (TEM) (green arrow). Swollen mitochondria in leukocytes observed by TEM (red arrow)</p></caption><graphic http://www.w3.org/1999/xlink href=""12920_2024_1960_Fig3_HTML"" id=""d33e347""></graphic></fig>",11_13,Macrothrombocytopenia with leukocyte inclusions in a patient with Wilson disease: a case report and literature review,17 7 2024,,Wilson_Disease
"Leukocyte copper content, measured using inductively coupled plasma mass spectrometry, was 1.41 fg/cell for the patient and 0.07 ± 0.04 fg/cell for the control group (<italic toggle=""yes"">n</italic> = 10), representing nearly a 20-fold increase in the patient. Based on these findings, the patient was diagnosed with WD according to the Leipzig scoring system proposed by an international group for the study of WD [<xref ref-type=""bibr"" rid=""CR5"">5</xref>]. The patient’s Leipzig score was 4 points (K-F rings",11_14,Macrothrombocytopenia with leukocyte inclusions in a patient with Wilson disease: a case report and literature review,17 7 2024,,Wilson_Disease
"patient’s Leipzig score was 4 points (K-F rings present, score 2; neurological symptoms, score 1; and only one chromosome detected, score 1). Therefore, the patient was prescribed the full dose of zinc sulfate (60 mg/dose, tid, p.o.) to treat WD. After 6 months of follow-up, they showed substantial improvement in their hand tremors, lower limb stiffness, ocular discomfort, and limb ecchymosis symptoms. Laboratory tests revealed a platelet count of 78 × 10<sup>9</sup>/L, serum ceruloplasmin concentration",11_15,Macrothrombocytopenia with leukocyte inclusions in a patient with Wilson disease: a case report and literature review,17 7 2024,,Wilson_Disease
"serum ceruloplasmin concentration increase from 23 mg/dL to 25 mg/dL, and serum albumin level rise from 35.97 g/L to 42.3 g/L. WD arises from homozygous or compound heterozygous mutations in <italic toggle=""yes"">ATP7B</italic>, a gene encoding a copper-transporting P-type ATPase [<xref ref-type=""bibr"" rid=""CR6"">6</xref>, <xref ref-type=""bibr"" rid=""CR7"">7</xref>]. Dysfunction in <italic toggle=""yes"">ATP7B</italic> leads to hepatic copper accumulation and excessive nonceruloplasmin-bound copper in the",11_16,Macrothrombocytopenia with leukocyte inclusions in a patient with Wilson disease: a case report and literature review,17 7 2024,,Wilson_Disease
"excessive nonceruloplasmin-bound copper in the circulation, resulting in copper uptake and subsequent injury to the brain and kidneys, among other organs [<xref ref-type=""bibr"" rid=""CR8"">8</xref>, <xref ref-type=""bibr"" rid=""CR9"">9</xref>]. Hepatic manifestations of WD range from asymptomatic transaminase elevation to fibrosis, cirrhosis, and acute liver failure. Heterozygotic carriers of faulty <italic toggle=""yes"">ATP7B</italic> may remain asymptomatic; however, 20% of cases exhibit copper metabolism",11_17,Macrothrombocytopenia with leukocyte inclusions in a patient with Wilson disease: a case report and literature review,17 7 2024,,Wilson_Disease
"however, 20% of cases exhibit copper metabolism abnormalities [<xref ref-type=""bibr"" rid=""CR10"">10</xref>]. Notably, some heterozygotic mutation carriers show limb tremors or liver symptoms [<xref ref-type=""bibr"" rid=""CR11"">11</xref>–<xref ref-type=""bibr"" rid=""CR13"">13</xref>]. A single T935M heterozygotic mutation in the <italic toggle=""yes"">ATP7B</italic> gene of patients with WD has not been previously reported. In this case, a single T935M heterozygotic mutation in <italic toggle=""yes"">ATP7B</italic>",11_18,Macrothrombocytopenia with leukocyte inclusions in a patient with Wilson disease: a case report and literature review,17 7 2024,,Wilson_Disease
"mutation in <italic toggle=""yes"">ATP7B</italic> was detected using WES and validated using Sanger sequencing. Furthermore, the patient gradually developed neurological symptoms and ocular discomfort, with K-F rings in the corneal limbus evident upon slit-lamp examination. Collectively, these findings confirmed the WD diagnosis. Moreover, effective zinc sulfate treatment corroborated the occurrence of excessive copper accumulation in the patient. Hemolysis is an important hematologic manifestation of",11_19,Macrothrombocytopenia with leukocyte inclusions in a patient with Wilson disease: a case report and literature review,17 7 2024,,Wilson_Disease
"is an important hematologic manifestation of Wilson’s disease. An analysis of 321 case notes of patients with Wilson’s disease seen between 1955 and 2000 and one case seen in 1949 has revealed that 22 patients presented with a haemolytic crisis. [<xref ref-type=""bibr"" rid=""CR14"">14</xref>]. Pop et al. reported that 8 children had Coombs-negative hemolytic anemia in the total analyzed cases with 51 WD patients (15.67%) [<xref ref-type=""bibr"" rid=""CR15"">15</xref>]. Despite large number of cases have been",11_20,Macrothrombocytopenia with leukocyte inclusions in a patient with Wilson disease: a case report and literature review,17 7 2024,,Wilson_Disease
"Despite large number of cases have been reported, however, the mechanism of hemolysis in WD remains unclear. In addition, other hematologic manifestations, including leukopenia and thrombocytopenia have been rarely reported [<xref ref-type=""bibr"" rid=""CR16"">16</xref>, <xref ref-type=""bibr"" rid=""CR17"">17</xref>]. In the present case, the patient exhibited thrombocytopenia, giant platelets, and Döhle-like cytoplasmic inclusions in leukocytes, similar to MHA. Interestingly, no <italic",11_21,Macrothrombocytopenia with leukocyte inclusions in a patient with Wilson disease: a case report and literature review,17 7 2024,,Wilson_Disease
"similar to MHA. Interestingly, no <italic toggle=""yes"">MYH9</italic> gene mutation was found. Therefore, we questioned whether these abnormal hematological findings were associated with WD. Mass spectrometry revealed that leukocyte copper levels were almost 20-fold higher in the patient than in the control group. Previous studies have shown that, compared with patients with homozygous mutations, carriers exhibit slower copper deposition due to a partial decline in <italic toggle=""yes"">ATP7B</italic> gene",11_22,Macrothrombocytopenia with leukocyte inclusions in a patient with Wilson disease: a case report and literature review,17 7 2024,,Wilson_Disease
