text,chunk_id,title,publication_date,authors,disease
"Investigation, Methodology, Writing – original draft. ST: Formal analysis, Methodology, Visualization, Writing – original draft, Writing – review & editing, Conceptualization. UT: Conceptualization, Data curation, Investigation, Writing – review & editing. SR: Data curation, Funding acquisition, Investigation, Resources, Supervision, Writing – review & editing. MS: Conceptualization, Data curation, Funding acquisition, Resources, Supervision, Writing – review & editing. PZ: Funding acquisition, Resources,",18_50,Wilson Disease and the COVID-19 pandemic: exploring patients’ mental health and vaccination attitudes in a longitudinal study,13 5 2024,,Wilson_Disease
"& editing. PZ: Funding acquisition, Resources, Supervision, Writing – review & editing.",18_51,Wilson Disease and the COVID-19 pandemic: exploring patients’ mental health and vaccination attitudes in a longitudinal study,13 5 2024,,Wilson_Disease
"Wilson Disease in Children in the Eastern Region of Morocco: Analysis of 24 Cases Wilson's disease (WD), or ""hepato-lenticular degeneration,"" is a rare genetic disorder of autosomal recessive inheritance causing toxic tissue accumulation of copper, mainly in the liver, brain, and cornea. Its phenotypic and genotypic heterogeneity characterizes it. This study aimed to clarify the clinical features and spectrum of Wilson's disease in children from the eastern region of Morocco and to study the evolutionary",19_0,Wilson Disease in Children in the Eastern Region of Morocco: Analysis of 24 Cases,10 5 2024,,Wilson_Disease
"region of Morocco and to study the evolutionary profile and survival in this population while discussing and highlighting the various diagnostic and therapeutic difficulties encountered in the management of WD in our context. This retrospective study encompassed 24 children diagnosed with Wilson's disease, selected from the gastroenterology-hepatology and pediatric nutrition units at Mohamed VI University Hospital in Oujda, Morocco, over a span of nine years, from January 2015 to November 2023. Our series",19_1,Wilson Disease in Children in the Eastern Region of Morocco: Analysis of 24 Cases,10 5 2024,,Wilson_Disease
"from January 2015 to November 2023. Our series results show 14 boys and 10 girls; the median age of discovery was 11 years, with extremes ranging from 18 months to 15 years. The consanguinity was found in 13 patients. Clinically, the edemato-ascitic syndrome was noted in 14 patients with an alteration of the general state; icterus was found in 13 patients; signs of portal hypertension were present in six patients; and neurological signs in seven cases. Skin manifestations occurred in three cases, and",19_2,Wilson Disease in Children in the Eastern Region of Morocco: Analysis of 24 Cases,10 5 2024,,Wilson_Disease
"Skin manifestations occurred in three cases, and arthralgia in three cases. Six children were diagnosed on the occasion of a family screening. Biologically, hepatic cytolysis was found in 20 patients, with signs of hepatocellular failure in 15 cases. Hemolytic anemia was present in nine patients. Ceruloplasminemia was decreased in 21 patients and cupremia in 19 patients. Cupruria was increased in 22 cases. The Kayser-Fleicher ring was found in 10 cases. Abdominal ultrasound showed ascites in 16 patients,",19_3,Wilson Disease in Children in the Eastern Region of Morocco: Analysis of 24 Cases,10 5 2024,,Wilson_Disease
"ultrasound showed ascites in 16 patients, hepatomegaly in 1, splenomegaly in two cases, hepatosplenomegaly in five cases, and cirrhosis in two. MRI showed signal abnormalities in 11 patients. Therapeutically, D-penicillamine was initially introduced in 18 patients and zinc acetate in 6 patients. The evolution was favorable for 15 patients still followed up in the department. Three patients died of hepatocellular failure, and two died of hepatic encephalopathy. Four patients were lost to follow-up. Wilson's",19_4,Wilson Disease in Children in the Eastern Region of Morocco: Analysis of 24 Cases,10 5 2024,,Wilson_Disease
"Four patients were lost to follow-up. Wilson's disease (WD) is a rare autosomal recessive genetic disorder affecting copper metabolism. It is a copper toxicosis characterized by tissue accumulation of free copper, mainly in the liver, brain, and pericornea [<xref rid=""REF1"" ref-type=""bibr"">1</xref>,<xref rid=""REF2"" ref-type=""bibr"">2</xref>]. It results from mutations in the ATP7B gene on chromosome 13. This ATP7B protein transports copper in the hepatocyte. In France, 906 cases of WD were identified in",19_5,Wilson Disease in Children in the Eastern Region of Morocco: Analysis of 24 Cases,10 5 2024,,Wilson_Disease
"In France, 906 cases of WD were identified in 2013, representing a clinical prevalence of 15.4 cases per million inhabitants [<xref rid=""REF2"" ref-type=""bibr"">2</xref>]. In Morocco, it remains underestimated due to the difficulty of diagnosis. The age of onset of the disease is often between 10 and 20 years, but it can occur at extreme ages [<xref rid=""REF3"" ref-type=""bibr"">3</xref>]. Diagnosis is based on a number of factors: clinical, biological (cardiac work-up), radiological (MRI), and even",19_6,Wilson Disease in Children in the Eastern Region of Morocco: Analysis of 24 Cases,10 5 2024,,Wilson_Disease
"(cardiac work-up), radiological (MRI), and even histological [<xref rid=""REF4"" ref-type=""bibr"">4</xref>]. This rare genetic disease has a good prognosis if treatment is initiated early and continued for life. In the absence of any treatment, spontaneous evolution is usually fatal. Currently, several therapeutic options are available to stabilize the disease and avoid the damage associated with copper accumulation, subject to good compliance [<xref rid=""REF2"" ref-type=""bibr"">2</xref>-<xref rid=""REF4""",19_7,Wilson Disease in Children in the Eastern Region of Morocco: Analysis of 24 Cases,10 5 2024,,Wilson_Disease
"ref-type=""bibr"">2</xref>-<xref rid=""REF4"" ref-type=""bibr"">4</xref>]. Our work aimed to clarify the clinical features and spectrum of Wilson's disease in children from the eastern region of Morocco and to study the evolutionary profile and survival in this population while discussing and highlighting the various diagnostic and therapeutic difficulties encountered in the management of WD in our context. We conducted a retrospective study of 24 children followed in the Pediatric Gastroenterology-Hepatology",19_8,Wilson Disease in Children in the Eastern Region of Morocco: Analysis of 24 Cases,10 5 2024,,Wilson_Disease
"in the Pediatric Gastroenterology-Hepatology and Nutrition Unit in the Pediatrics Department of the Mohamed VI Hospital and University Center in Oujda over a nine-year period from January 2015 to November 2023. The inclusion criteria used in our series were children under 16 years of age with liver damage and/or neurological impairment, disturbed copper balance, and/or the presence of a Kayser-Fleischer ring. We have excluded children aged over 16 who had a normal copper balance. Data were collected from",19_9,Wilson Disease in Children in the Eastern Region of Morocco: Analysis of 24 Cases,10 5 2024,,Wilson_Disease
"a normal copper balance. Data were collected from the patient's medical records. An Excel file (Microsoft® Corp., Redmond, WA) was created to collect anamnestic, clinical, biological, radiological, and therapeutic data. We analyzed clinical, biological (hepatic and cupric), and evolutionary characteristics. Family screening was carried out by clinical examination and analysis of the siblings' copper levels. The average number of cases in our series was three per year. The average age of onset of Wilson's",19_10,Wilson Disease in Children in the Eastern Region of Morocco: Analysis of 24 Cases,10 5 2024,,Wilson_Disease
"per year. The average age of onset of Wilson's disease was 11 years, with extremes of 18 months and 15 years. The age group most affected was 8 to 12 years old. Among all patients, there was a predominance of males, with 14 boys out of 24 (58%) and 10 girls (42%), giving a sex ratio (M/F) of 1.4. Consanguinity was found in 13 patients (54%). Nine of them had first-degree consanguinity; the other four had second-degree consanguinity. The case histories of our patients included eight cases of death in",19_11,Wilson Disease in Children in the Eastern Region of Morocco: Analysis of 24 Cases,10 5 2024,,Wilson_Disease
"of our patients included eight cases of death in siblings with similar symptoms, one child who had failed at school, four cases of recurrent epistaxis, and one child with chronic headaches. All our patients had a progressive onset of clinical manifestations. However, the delay between the appearance of the first clinical signs and the diagnostic consultation varied from 6 days to 12 months, with an average of two months. The main reason for consultation was the edemato-ascitic syndrome, seen in 14 children",19_12,Wilson Disease in Children in the Eastern Region of Morocco: Analysis of 24 Cases,10 5 2024,,Wilson_Disease
"the edemato-ascitic syndrome, seen in 14 children (58%), with edema of the lower limbs and ascites, and an altered general state, with asthenia, anorexia, and weight loss, seen in 18 patients (75%). Jaundice was present in 13 patients, i.e., half the cases, and digestive signs (abdominal pain, nausea, vomiting, and diarrhea) in seven patients. Seven out of twenty-four children had hepatomegaly; collateral venous circulation was present in seven patients; and splenomegaly was present in six children as part",19_13,Wilson Disease in Children in the Eastern Region of Morocco: Analysis of 24 Cases,10 5 2024,,Wilson_Disease
"splenomegaly was present in six children as part of portal hypertension syndrome (PHS). Neuropsychiatric signs were present in seven patients aged between 8 and 15 years. The average time to onset of clinical signs in these seven cases was two months, with extremes of 13 days and 7 months. The neurological examination revealed extrapyramidal signs in four cases (slowness of gestures and ideation, frozen face), a sardonic smile in one case, a behavioral disorder in two cases, and micrography in three cases,",19_14,Wilson Disease in Children in the Eastern Region of Morocco: Analysis of 24 Cases,10 5 2024,,Wilson_Disease
"in two cases, and micrography in three cases, one of which was associated with one of the two patients with a behavioral disorder. Three patients presented with arthralgia and/or limited joint mobility, and five patients were asymptomatic at the time of screening among the siblings of the patients in our series. Regarding the dermatological manifestations of WD, cutaneous hyperpigmentation was noted in two patients in our series and one case of cutaneous xerosis. Clinical signs are shown in Table <xref",19_15,Wilson Disease in Children in the Eastern Region of Morocco: Analysis of 24 Cases,10 5 2024,,Wilson_Disease
"xerosis. Clinical signs are shown in Table <xref rid=""TAB1"" ref-type=""table"">1</xref>. Slit-lamp ophthalmological examination revealed the presence of the Kayser-Fleisher ring (KFR) in 10 patients, i.e., 42% of cases (Figure <xref rid=""FIG1"" ref-type=""fig"">1</xref>), nine of whom were over eight years old and one six-year-old with incipient KFR. The mean time for disease progression was five weeks. Biologically, transaminases were normal in four patients (17%), moderately elevated in 11 (46%), and very",19_16,Wilson Disease in Children in the Eastern Region of Morocco: Analysis of 24 Cases,10 5 2024,,Wilson_Disease
"(17%), moderately elevated in 11 (46%), and very elevated in nine children (37%). Prothrombin level (PT) was below 40% in 13 patients (54% of cases), between 40% and 70% in two children, and normal in nine patients, six of whom had undergone family screening. Factor V was performed in 11 patients and collapsed in 8. Hypoalbuminemia was noted in 16 patients, i.e., 67% of cases. Protein electrophoresis (PEP), performed in seven patients, showed hypoalbuminemia in all cases, associated with polyclonal",19_17,Wilson Disease in Children in the Eastern Region of Morocco: Analysis of 24 Cases,10 5 2024,,Wilson_Disease
"in all cases, associated with polyclonal hypergamma-globulinemia characterized by a beta-gamma-globulinemia block compatible with hepatocellular failure in six cases. Hematologically, hemolytic anemia was found in nine patients (37%), thrombocytopenia in 11 (46%), and moderate leukopenia with WBC counts of between 1,500 and 4,500 elements/mm3 in four patients. Ceruleoplasminemia was reduced in 21 patients (88%), normal in one child (4%), and not performed in two cases. Cupremia was reduced in 19 patients",19_18,Wilson Disease in Children in the Eastern Region of Morocco: Analysis of 24 Cases,10 5 2024,,Wilson_Disease
"in two cases. Cupremia was reduced in 19 patients (79%), increased in one, and not performed in four. Cupruria was performed in 22 patients and was found to be increased in all children. Relative exchangeable copper (REC) was measured in nine patients and found to be elevated (Table <xref rid=""TAB2"" ref-type=""table"">2</xref>). Abdominal ultrasonography showed ascites in 16 patients (67%) associated with cirrhosis of the liver in two cases, hepatosplenomegaly in five cases, hepatomegaly alone in one case,",19_19,Wilson Disease in Children in the Eastern Region of Morocco: Analysis of 24 Cases,10 5 2024,,Wilson_Disease
"in five cases, hepatomegaly alone in one case, and splenomegaly alone in two cases. Hepatosplenomegaly without ascites was noted in two cases and isolated hepatomegaly in two children. The other patients were diagnosed by family screening and had normal ultrasounds. Digestive fibroscopy was performed on three patients. It showed stage I esophageal varices without red signs in one patient and moderate antritis in another. In the remaining case, eso-gastroduodenal fibroscopy was normal. A cerebral MRI was",19_20,Wilson Disease in Children in the Eastern Region of Morocco: Analysis of 24 Cases,10 5 2024,,Wilson_Disease
"fibroscopy was normal. A cerebral MRI was carried out in all our patients and revealed bilateral and symmetrical T1 hyper-signal of the pallidum in four cases, bilateral and symmetrical involvement of the basal ganglia in four cases (T2 hypersignal; Figure <xref rid=""FIG2"" ref-type=""fig"">2</xref>), bilateral and symmetrical involvement of the lenticular and mesencephalic nuclei in one case, a giant Panda head appearance in one case and an appearance consistent with leukodystrophy in another. In the",19_21,Wilson Disease in Children in the Eastern Region of Morocco: Analysis of 24 Cases,10 5 2024,,Wilson_Disease
"consistent with leukodystrophy in another. In the remaining cases, MRI scans showed no abnormalities. A liver biopsy was performed on only one patient in our series, showing chronic liver disease. It was not performed in the other patients, given the severe liver damage and very low prothrombin levels. In terms of treatment, all the children and their parents benefited from a dietary consultation with the introduction of a low-copper diet. Eighteen of our patients were treated with D-penicillamine",19_22,Wilson Disease in Children in the Eastern Region of Morocco: Analysis of 24 Cases,10 5 2024,,Wilson_Disease
"of our patients were treated with D-penicillamine (TROLOVOL® /CUPRIPEN®), with doses gradually increased to two to three times daily on an empty stomach, reaching the full dose by the fourth week. Of these 18 patients, three were switched to zinc acetate due to severe toxidermia with hematological damage in one patient and the unavailability of D-penicillamine on the Moroccan pharmacological market in two patients. The last six patients were treated immediately with zinc acetate (WILZIN®), with the dosage",19_23,Wilson Disease in Children in the Eastern Region of Morocco: Analysis of 24 Cases,10 5 2024,,Wilson_Disease
"with zinc acetate (WILZIN®), with the dosage depending on the age and weight of each patient. None of the patients received vitamin B6. Liver transplantation was not indicated in any patient in our series. As adjuvant therapy, 14 patients with edemato-ascitic syndrome were started on diuretics (spironolactone, furosemide) at a dose of 2-4 mg/kg/d with diuresis monitoring, and 15 patients were started on vitamin K (10 mg/d), in view of clinical and biological cholestasis and low PT, in addition to",19_24,Wilson Disease in Children in the Eastern Region of Morocco: Analysis of 24 Cases,10 5 2024,,Wilson_Disease
"biological cholestasis and low PT, in addition to transfusions of fresh frozen plasma (nine cases for hepatocellular insufficiency), platelet and red blood cells (one case with poorly tolerated anemia and severe thrombocytopenia), as well as albumin infusions (seven children). Treatment-related side effects were noted in 11 patients, i.e., half the cases. Hematological side effects included 10 cases of thrombocytopenia and 6 cases of leukopenia. On the neurological front, two cases of neurological",19_25,Wilson Disease in Children in the Eastern Region of Morocco: Analysis of 24 Cases,10 5 2024,,Wilson_Disease
"the neurological front, two cases of neurological aggravation, such as agitation, were observed in connection with hepatic encephalopathy and generalized convulsive seizures (without post-critical deficit) one week after the initiation of D-penicillamine. On the gastrointestinal front, only one patient suffered mild hematemesis with melena due to an error in the administration of zinc acetate [75 mg divided into two doses (50 mg and 25 mg) instead of 3], necessitating transfusion of the patient with packed",19_26,Wilson Disease in Children in the Eastern Region of Morocco: Analysis of 24 Cases,10 5 2024,,Wilson_Disease
"transfusion of the patient with packed red blood cells and the administration of a PPI (2 mg/kg/d). Side effects such as nausea, vomiting, and disgust were observed in five patients. In addition, a case of severe cutaneous toxidermia (pruritic maculopapular lesions and purpuric spots) associated with hematological damage two days after the start of treatment, necessitating a change in treatment, and a case of stretch marks after administration of D-penicillamine were noted. After an average follow-up of",19_27,Wilson Disease in Children in the Eastern Region of Morocco: Analysis of 24 Cases,10 5 2024,,Wilson_Disease
"were noted. After an average follow-up of four and a half years, with extremes ranging from two months to nine years, the evolution was favorable, with good efficacy and clinico-biological tolerance, including the disappearance of symptoms, normal growth and schooling, and normalization of the biological balance, in 15 patients who are still being followed in the Pediatric Department. On the other hand, there were five deaths, three of which were the result of decompensated cirrhosis in patients who had",19_28,Wilson Disease in Children in the Eastern Region of Morocco: Analysis of 24 Cases,10 5 2024,,Wilson_Disease
"of decompensated cirrhosis in patients who had consulted us late for edematous-ascitic syndrome, jaundice, and hepatocellular insufficiency, and two of which were the result of hepatic encephalopathy. In addition, the evolution of four patients could not be assessed because they had been lost to follow-up. In our series, a family investigation was systematically carried out in all patients, with a copper work-up in the siblings. This investigation led to the diagnosis of five cases included in the series.",19_29,Wilson Disease in Children in the Eastern Region of Morocco: Analysis of 24 Cases,10 5 2024,,Wilson_Disease
"diagnosis of five cases included in the series. The genetic prevalence of WD in France is estimated at 30/1,000,00 [<xref rid=""REF5"" ref-type=""bibr"">5</xref>]. In France, 906 cases of WD were identified in 2013, representing a clinical prevalence of 15.4 cases per million inhabitants [<xref rid=""REF2"" ref-type=""bibr"">2</xref>]. Consanguinity considerably increases the incidence of WD [<xref rid=""REF4"" ref-type=""bibr"">4</xref>]. Given the frequency of consanguineous marriages, it is thought to be fairly",19_30,Wilson Disease in Children in the Eastern Region of Morocco: Analysis of 24 Cases,10 5 2024,,Wilson_Disease
"marriages, it is thought to be fairly common in Maghreb countries. Its exact incidence in these countries is unknown. In Morocco, it remains underestimated due to the difficulty of diagnosis. The age of onset of the disease is often between 10 and 20 years, but it can occur at the extremes of life [<xref rid=""REF3"" ref-type=""bibr"">3</xref>]. This disease is characterized by a diversity of clinical manifestations, dominated by hepatic, neurological, and ocular symptoms, which may be isolated, associated, or",19_31,Wilson Disease in Children in the Eastern Region of Morocco: Analysis of 24 Cases,10 5 2024,,Wilson_Disease
"symptoms, which may be isolated, associated, or follow one another [<xref rid=""REF2"" ref-type=""bibr"">2</xref>]. In children, the first symptoms are usually hepatic, whereas in adults, the symptoms are mainly neuropsychiatric. The disease may also manifest itself through renal, hematological, endocrine, or cardiovascular manifestations [<xref rid=""REF6"" ref-type=""bibr"">6</xref>]. Some authors report that forms with a hepatic presentation have a risk of death five times higher than forms with a neurological",19_32,Wilson Disease in Children in the Eastern Region of Morocco: Analysis of 24 Cases,10 5 2024,,Wilson_Disease
"five times higher than forms with a neurological presentation [<xref rid=""REF7"" ref-type=""bibr"">7</xref>]. In our study, the first manifestations were hepatic in 22 patients (92%) and neurological in 2 patients (8%). Hepatic involvement is often isolated in children, discovered between the ages of 5 and 13. Several clinical pictures can be revealed, ranging from a simple increase in transaminases to fulminant hepatitis [<xref rid=""REF8"" ref-type=""bibr"">8</xref>]. In our series, the majority of our patients",19_33,Wilson Disease in Children in the Eastern Region of Morocco: Analysis of 24 Cases,10 5 2024,,Wilson_Disease
"In our series, the majority of our patients presented immediately with cirrhosis, suggesting a delay in diagnosis probably due to three factors: most often, a delay in consultation, but sometimes also due to the clinical heterogeneity that makes the diagnostic hypothesis difficult, as well as a rapidly severe evolution, since the average time to progression found in Moroccan children with WD in the eastern region was two months. Admittedly, the first symptoms are mainly hepatic in children, but in our",19_34,Wilson Disease in Children in the Eastern Region of Morocco: Analysis of 24 Cases,10 5 2024,,Wilson_Disease
"are mainly hepatic in children, but in our series, we reported one child who presented purely with neuropsychiatric symptoms with no other associated damage, notably hepatic. Although neurological involvement is exceptional before the age of 12, we have described three children under the age of 12 (8 and 10 years old) whose neurological symptoms occurred after liver involvement in two cases and concomitantly with liver damage in only one child. Gradually and without treatment, the classic neurological",19_35,Wilson Disease in Children in the Eastern Region of Morocco: Analysis of 24 Cases,10 5 2024,,Wilson_Disease
"and without treatment, the classic neurological picture of the disease develops a dystonic syndrome characterized by dystonic postures and choreoathetotic movements, an ataxic syndrome with postural and intention tremor and limb ataxia, and an extrapyramidal syndrome with hypokinesia, mainly axial hypertonia and rest tremor [<xref rid=""REF2"" ref-type=""bibr"">2</xref>,<xref rid=""REF6"" ref-type=""bibr"">6</xref>,<xref rid=""REF9"" ref-type=""bibr"">9</xref>]. The facial expression of the ""Wilsonian"" patient is",19_36,Wilson Disease in Children in the Eastern Region of Morocco: Analysis of 24 Cases,10 5 2024,,Wilson_Disease
"facial expression of the ""Wilsonian"" patient is often very suggestive: the face is set, the mouth is open, and the hypertonicity of the perioral muscles gives the appearance of a permanent sardonic smile [<xref rid=""REF6"" ref-type=""bibr"">6</xref>,<xref rid=""REF9"" ref-type=""bibr"">9</xref>]. In most cases, symptoms develop very gradually, but a sudden onset after a triggering factor such as trauma or especially surgery under general anesthesia has been described [<xref rid=""REF6"" ref-type=""bibr"">6</xref>].",19_37,Wilson Disease in Children in the Eastern Region of Morocco: Analysis of 24 Cases,10 5 2024,,Wilson_Disease
"[<xref rid=""REF6"" ref-type=""bibr"">6</xref>]. It should also be noted that WD may be manifested by torticollis [<xref rid=""REF10"" ref-type=""bibr"">10</xref>]. Psychiatric disorders are inaugural in 15% of cases or accompany neurological manifestations [<xref rid=""REF11"" ref-type=""bibr"">11</xref>]. The usual ophthalmological feature of WD is the green pericorneal Kayser-Fleischer ring, which reflects copper deposits in Descemet's membrane. It is carefully examined with a slit lamp and is almost pathognomonic",19_38,Wilson Disease in Children in the Eastern Region of Morocco: Analysis of 24 Cases,10 5 2024,,Wilson_Disease
