text,chunk_id,title,publication_date,authors,disease
"rid=""CR11"">11</xref>]. These findings are also in line with prior research supporting the usefulness of the UWDRS in patients with WD. While patients with WD present with multisystem symptoms and impacts, this CE interview study highlighted a broad range of salient neurological signs/symptoms as well as impacts. The salient neurological concepts identified include change in balance, change in walking, change in writing, drooling, other changes in speech, slurred speech, and tremor. Only one other salient",22_18,Exploring the Content Validity of the Unified Wilson Disease Rating Scale: Insights from Qualitative Research,4 4 2024,,Wilson_Disease
"speech, and tremor. Only one other salient concept, dizziness, identified in the previous study [<xref ref-type=""bibr"" rid=""CR6"">6</xref>], was not identified as salient in this study. In addition to the large number of neurological concepts reported, patients described many of the concepts as being highly bothersome. Bothersome ratings provided highlight a high degree of bother associated with the neurological aspects of WD and negative impact on patients’ lives. Karantzoulis et al. [<xref ref-type=""bibr""",22_19,Exploring the Content Validity of the Unified Wilson Disease Rating Scale: Insights from Qualitative Research,4 4 2024,,Wilson_Disease
"lives. Karantzoulis et al. [<xref ref-type=""bibr"" rid=""CR6"">6</xref>] showed that not all patients with WD experience neurological signs/symptoms due to their WD. However, for those who do, this data underscores the importance of understanding how future treatments may affect these bothersome neurological concepts. Mapping neurological concepts identified in the CE interviews with items of the UWDRS Parts II and III demonstrates almost complete coverage of all neurological signs and symptoms, and complete",22_20,Exploring the Content Validity of the Unified Wilson Disease Rating Scale: Insights from Qualitative Research,4 4 2024,,Wilson_Disease
"all neurological signs and symptoms, and complete coverage of salient neurological signs and symptoms by the UWDRS. This data suggests that the UWDRS Parts II and III is comprehensive in its conceptual coverage of the neurological aspects of WD. UWDRS Part II item debriefing with patients demonstrated that the Part II items of the UWDRS were generally clear and easily understood, and most patients considered items personally relevant to their experience with WD. Three patients expressed concerns regarding",22_21,Exploring the Content Validity of the Unified Wilson Disease Rating Scale: Insights from Qualitative Research,4 4 2024,,Wilson_Disease
"WD. Three patients expressed concerns regarding the clarity of the toilet use item, though the majority reported this item to be clear and relevant. These data provide supportive evidence for the content validity of Part II of the UWDRS. This suggests that patients enrolled in a clinical trial would understand and consider these Part II items to be relevant. The main strengths of this study are the multiple streams of research conducted, including the CE interviews, concept/instrument mapping, and CD",22_22,Exploring the Content Validity of the Unified Wilson Disease Rating Scale: Insights from Qualitative Research,4 4 2024,,Wilson_Disease
"CE interviews, concept/instrument mapping, and CD interviews. The CE interviews conducted with the “neuro-enriched sample” further support the results published in Karantzoulis et al. [<xref ref-type=""bibr"" rid=""CR6"">6</xref>]. The number of patients interviewed and the heterogeneous experiences they reported further strengthens the body of evidence gathered to date. This study has a few potential limitations. Patients actively volunteered to participate in this study, creating the possibility of selection",22_23,Exploring the Content Validity of the Unified Wilson Disease Rating Scale: Insights from Qualitative Research,4 4 2024,,Wilson_Disease
"this study, creating the possibility of selection bias in the sample. The cognitive debriefing interviews were conducted in English with patients primarily located in the US. Therefore, the results of the cognitive debriefing interviews may not be generalizable to other regions/languages for which the UWDRS may be deployed. Additionally, while some patients who reviewed the select Part III items found these items to be relevant, conclusions cannot be made regarding content validity of Part III from this",22_24,Exploring the Content Validity of the Unified Wilson Disease Rating Scale: Insights from Qualitative Research,4 4 2024,,Wilson_Disease
"regarding content validity of Part III from this study. In order to do so, the relevance and clarity of these items will need to be explored with individuals who would complete Part III, i.e., study clinicians. Importantly this work, along with Karantzoulis et al. [<xref ref-type=""bibr"" rid=""CR6"">6</xref>], highlights other important aspects of the patient experiences—specifically, psychiatric and hepatic signs/symptoms. The UWDRS does not cover these concepts and therefore does not assess the full patient",22_25,Exploring the Content Validity of the Unified Wilson Disease Rating Scale: Insights from Qualitative Research,4 4 2024,,Wilson_Disease
"and therefore does not assess the full patient experience. To evaluate the full patient experience, a robust COA strategy that includes the UWDRS and other clinical outcome assessments that map onto the hepatic and psychiatric symptoms is needed. Further, as reported in Karantzoulis et al. [<xref ref-type=""bibr"" rid=""CR6"">6</xref>], only a portion of patients with WD experience neurological signs/symptoms. As such, scales and endpoints created from the UWDRS may be limited in a broad WD population, with a",22_26,Exploring the Content Validity of the Unified Wilson Disease Rating Scale: Insights from Qualitative Research,4 4 2024,,Wilson_Disease
"may be limited in a broad WD population, with a proportion of patients appearing “asymptomatic”, as the coverage of UWDRS is limited to neurological symptoms/impacts. Scales and endpoints derived from the UWDRS must take into consideration the heterogeneity of the WD population. Specifically, in some patients, there is a lack of neurological symptoms/impacts and there is variability even among those patients with neurological symptoms/impacts. Meaningfully derived scales/scores for the UWDRS will be",22_27,Exploring the Content Validity of the Unified Wilson Disease Rating Scale: Insights from Qualitative Research,4 4 2024,,Wilson_Disease
"derived scales/scores for the UWDRS will be critical for this population and instrument, given the heterogeneity of the population and the range of neurological symptoms/impacts measured. Overall, the data from this study provides evidence for the content validity of Part II of the UWDRS as well as further evidence supporting the conceptual relevance and comprehensibility of select items of Part III of the UWDRS. Specifically, all salient neurological signs/symptoms identified in patient interviews are",22_28,Exploring the Content Validity of the Unified Wilson Disease Rating Scale: Insights from Qualitative Research,4 4 2024,,Wilson_Disease
"identified in patient interviews are represented by one or more of the items in Part II and/or Part III of the UWDRS, suggesting that the UWDRS is comprehensive in its coverage of the neurological aspects of WD. Further, Part II of the UWDRS includes items that are confirmed to be well understood and relevant to patients with WD who have a history of neurological signs/symptoms. As the neurological concepts reported are noted by patients as very bothersome, having a COA like the UWDRS that has strong",22_29,Exploring the Content Validity of the Unified Wilson Disease Rating Scale: Insights from Qualitative Research,4 4 2024,,Wilson_Disease
"having a COA like the UWDRS that has strong conceptual coverage, including for bothersome neurological symptoms, and has items that are relevant and understood by the patients supports its use in the context of a clinical trial to evaluate treatment effect. Importantly, the UWDRS should be used in conjunction with other COAs to provide a comprehensive assessment of the patient experience and scales and endpoints derived from the UWDRS (and other instruments) should take into consideration the heterogeneity",22_30,Exploring the Content Validity of the Unified Wilson Disease Rating Scale: Insights from Qualitative Research,4 4 2024,,Wilson_Disease
should take into consideration the heterogeneity of the population.,22_31,Exploring the Content Validity of the Unified Wilson Disease Rating Scale: Insights from Qualitative Research,4 4 2024,,Wilson_Disease
"Research progress in stem cell therapy for Wilson disease Wilson disease (WD), also known as hepatolenticular degeneration, is an autosomal recessive disorder characterized by disorganized copper metabolism caused by mutations in the <italic toggle=""yes"">ATP7B</italic> gene. Currently, the main treatment options for WD involve medications such as d-penicillamine, trientine hydrochloride, zinc acetate, and liver transplantation. However, there are challenges that encompass issues of poor compliance, adverse",23_0,Research progress in stem cell therapy for Wilson disease,15 3 2024,,Wilson_Disease
"that encompass issues of poor compliance, adverse effects, and limited availability of liver sources that persist. Stem cell therapy for WD is currently a promising area of research. Due to the advancement in stem cell directed differentiation technology in vitro and the availability of sufficient stem cell donors, it is expected to be a potential treatment option for the permanent correction of abnormal copper metabolism. This article discusses the research progress of stem cell therapy for WD from",23_1,Research progress in stem cell therapy for Wilson disease,15 3 2024,,Wilson_Disease
"progress of stem cell therapy for WD from various sources, as well as the challenges and future prospects of the clinical application of stem cell therapy for WD. Wilson disease, also known as hepatolenticular degeneration, is a rare autosomal recessive inherited disease characterized by a primary dysfunction of copper metabolism [<xref rid=""bib1"" ref-type=""bibr"">1</xref>]. The pathogenic gene <italic toggle=""yes"">ATP7B</italic> in WD encodes transmembrane copper-transporting ATPase 2, which is",23_2,Research progress in stem cell therapy for Wilson disease,15 3 2024,,Wilson_Disease
"copper-transporting ATPase 2, which is predominantly expressed in hepatocytes. Mutations in the <italic toggle=""yes"">ATP7B</italic> gene result in functional defects or loss of the enzyme, leading to obstacles in ceruloplasmin synthesis and copper excretion in bile [<xref rid=""bib2"" ref-type=""bibr"">2</xref>]. Copper metabolism disorders can cause excessive deposition of copper in liver cells, leading to necrosis of the cells. After cell lysis, copper ions loosely bind to serum albumin and are deposited in",23_3,Research progress in stem cell therapy for Wilson disease,15 3 2024,,Wilson_Disease
"bind to serum albumin and are deposited in large quantities in various organs through the bloodstream, causing liver damage, neurological and psychiatric symptoms, kidney damage, bone and joint disease, and the observation of Kayser-Fleischer rings in the cornea [<xref rid=""bib3"" ref-type=""bibr"">[3]</xref>, <xref rid=""bib4"" ref-type=""bibr"">[4]</xref>, <xref rid=""bib5"" ref-type=""bibr"">[5]</xref>, <xref rid=""bib6"" ref-type=""bibr"">[6]</xref>]. The estimated worldwide frequency of carriers of the <italic",23_4,Research progress in stem cell therapy for Wilson disease,15 3 2024,,Wilson_Disease
"worldwide frequency of carriers of the <italic toggle=""yes"">ATP7B</italic> mutation gene is approximately 1 in 90 individuals, considering the prevalence of symptomatic diseases ranging from 1:2600–1:30000 [<xref rid=""bib7"" ref-type=""bibr"">7</xref>]. WD is underestimated, according to a statistical report from the UK, the estimated frequency of individuals carrying two pathogenic <italic toggle=""yes"">ATP7B</italic> mutant alleles is approximately 1:7000, with potentially up to 2.5% of the general",23_5,Research progress in stem cell therapy for Wilson disease,15 3 2024,,Wilson_Disease
"with potentially up to 2.5% of the general population with heterozygous mutations [<xref rid=""bib8"" ref-type=""bibr"">8</xref>]. The incidence of WD might be underestimated as a result of the intricate nature of its clinical symptoms and the challenges involved in diagnosing it solely through clinical manifestations and physiological or biochemical tests. This may cause misdiagnosis or failure to identify cases. With growing physician awareness and decreasing costs of whole-exome sequencing, there appears to",23_6,Research progress in stem cell therapy for Wilson disease,15 3 2024,,Wilson_Disease
"costs of whole-exome sequencing, there appears to be an increasing trend in the number of diagnosed cases of WD. The common clinical symptoms of WD are mainly in the following areas. Firstly, liver disease is the first clinical manifestation in 40%–60% of patients with WD, including cirrhosis, chronic hepatitis and acute liver failure. Secondly, among the most prevalent neurological manifestations of WD, tremor, dystonia and parkinsonism are predominant. Thirdly, Kayser-Fleischer rings in the cornea and",23_7,Research progress in stem cell therapy for Wilson disease,15 3 2024,,Wilson_Disease
"Thirdly, Kayser-Fleischer rings in the cornea and sunflower cataracts in the eye are pathological manifestations of copper deposition in the eyes of WD patients. Fourthly, skeletal involvement is also a common manifestation of WD, including osteoporosis, chondrocalcinosis, osteoarthritis, and joint pain. Copper buildup in the synovium and cartilage is widely recognized as the primary factor contributing to arthritis in patients with WD. Finally, WD-induced acute copper toxicity results in Coombs-negative",23_8,Research progress in stem cell therapy for Wilson disease,15 3 2024,,Wilson_Disease
"acute copper toxicity results in Coombs-negative hemolytic anemia with varying degrees of rhabdomyolysis and renal tubular damage. In addition to typical clinical symptoms, low serum ceruloplasmin levels, increased urinary copper levels, and abnormal serum biochemical markers such as aspartate transaminase, alanine transaminase, gamma-glutamyl transpeptidase, and bilirubin can also be used as auxiliary diagnostic indicators for WD. WD patients can be reported at any age, but they are mostly observed in the",23_9,Research progress in stem cell therapy for Wilson disease,15 3 2024,,Wilson_Disease
"at any age, but they are mostly observed in the 5 to 35-year-old range, primarily in children and adolescents. The prevalence is comparable between males and females, and significant variations in symptoms exist among different patients [<xref rid=""bib9"" ref-type=""bibr"">9</xref>]. Once diagnosed, WD patients should receive prompt treatment, with the principle being early treatment, lifelong treatment, and lifelong monitoring [<xref rid=""bib10"" ref-type=""bibr"">10</xref>]. Because the organs involved and the",23_10,Research progress in stem cell therapy for Wilson disease,15 3 2024,,Wilson_Disease
"Because the organs involved and the degree of damage also vary, the main symptoms manifest as liver and neurological damage. Of these, symptoms of liver disease appear earliest, with some infant WD patients had symptoms at the age of two weeks after the end of breastfeeding, and the neurological disease develops relatively late, usually after the age of 15 [<xref rid=""bib11"" ref-type=""bibr"">11</xref>,<xref rid=""bib12"" ref-type=""bibr"">12</xref>]. During the initial stages of WD treatment, primary",23_11,Research progress in stem cell therapy for Wilson disease,15 3 2024,,Wilson_Disease
"the initial stages of WD treatment, primary therapeutic approaches encompass the administration of copper chelating agents (such as d-penicillamine and trientine hydrochloride) and zinc acetate therapy (<xref rid=""tbl1"" ref-type=""table"">Table 1</xref>). The pharmacological treatment principle outlined above revolves around inducing a negative copper balance within the body through the administration of specific drugs, chelating copper in the blood and tissues, and promoting urinary excretion of copper, and",23_12,Research progress in stem cell therapy for Wilson disease,15 3 2024,,Wilson_Disease
"and promoting urinary excretion of copper, and reducing copper intake in the digestive tract [<xref rid=""bib13"" ref-type=""bibr"">13</xref>,<xref rid=""bib14"" ref-type=""bibr"">14</xref>]. Presymptomatic WD patients who are taking their medications as prescribed have similar mortality rates to the general population [<xref rid=""bib15"" ref-type=""bibr"">15</xref>]. Although drug therapy for WD has been effective in some patients, particularly those with hepatic symptoms, there are limitations to current treatment",23_13,Research progress in stem cell therapy for Wilson disease,15 3 2024,,Wilson_Disease
"there are limitations to current treatment methods. Approximately 50% of WD patients still experience neurological symptoms during treatment [<xref rid=""bib16"" ref-type=""bibr"">16</xref>]. About 1/3 of WD patients experience adverse drug reactions, with d-penicillamine being associated with more adverse reactions such as nausea, vomiting, skin rash, fever, and even systemic lupus erythematosus [<xref rid=""bib17"" ref-type=""bibr"">17</xref>,<xref rid=""bib18"" ref-type=""bibr"">18</xref>]. The treatment regimens",23_14,Research progress in stem cell therapy for Wilson disease,15 3 2024,,Wilson_Disease
"The treatment regimens for WD are often complex and cumbersome (3 times daily, 2 h before meals, etc.) with a high number of adverse effects, resulting in poor medication adherence, ultimately leading to a mortality rate for WD patients that is 5–6.1% higher compared to the general population, mainly due to severe liver disease or severe neurological symptoms, with a few patients committing suicide due to disease burden or depression [<xref rid=""bib1"" ref-type=""bibr"">1</xref>,<xref rid=""bib10""",23_15,Research progress in stem cell therapy for Wilson disease,15 3 2024,,Wilson_Disease
"ref-type=""bibr"">1</xref>,<xref rid=""bib10"" ref-type=""bibr"">10</xref>,<xref rid=""bib19"" ref-type=""bibr"">19</xref>]. Hence, it is imperative to expedite the development of novel therapeutic alternatives that can both relieve neurological symptoms, reduce the number of medications taken, improve patient confidence in adhering to treatment, and also restore ATP7B function.<table-wrap position=""float"" id=""tbl1""><label>Table 1</label><caption><p>Clinical symptoms and current corresponding treatment",23_16,Research progress in stem cell therapy for Wilson disease,15 3 2024,,Wilson_Disease
"symptoms and current corresponding treatment strategies.</p></caption><alt-text id=""alttext0025"">Table 1</alt-text><table frame=""hsides"" rules=""groups""><thead><tr><th>Clinical Diseases</th><th>Specific symptoms</th><th>Current treatment strategies</th><th>References</th></tr></thead><tbody><tr><td rowspan=""2"">Hepatopathy</td><td>Cirrhosis, chronic hepatitis</td><td>D-penicillamine, zinc acetate, DMPS, DMSA</td><td>[<xref rid=""bib26"" ref-type=""bibr"">[26]</xref>, <xref rid=""bib27""",23_17,Research progress in stem cell therapy for Wilson disease,15 3 2024,,Wilson_Disease
"ref-type=""bibr"">[26]</xref>, <xref rid=""bib27"" ref-type=""bibr"">[27]</xref>, <xref rid=""bib28"" ref-type=""bibr"">[28]</xref>]</td></tr><tr><td>acute liver failure</td><td>liver transplantation</td><td></td></tr><tr><td>Neuropsychology</td><td>Mild dystonia, Tremor, muscle rigidity, movement disorders, dysarthria, severe dystonia</td><td>DMPS, DMSA (first choice), zinc acetate, D-penicillamine (use cautiously or not)</td><td>[<xref rid=""bib29"" ref-type=""bibr"">[29]</xref>, <xref rid=""bib30""",23_18,Research progress in stem cell therapy for Wilson disease,15 3 2024,,Wilson_Disease
"ref-type=""bibr"">[29]</xref>, <xref rid=""bib30"" ref-type=""bibr"">[30]</xref>, <xref rid=""bib31"" ref-type=""bibr"">[31]</xref>]</td></tr><tr><td>Ophthalmic diseases</td><td>Kayser-Fleischer ring, sunflower cataract</td><td>D-penicillamine, DMPS, DMSA, zinc acetate</td><td>[<xref rid=""bib1"" ref-type=""bibr"">1</xref>]</td></tr><tr><td>Osteoarticular diseases</td><td>Osteoporosis, chondrocalcinosis, osteoarthritis, joint pain</td><td>D-penicillamine, DMPS, DMSA, zinc acetate</td><td>[<xref rid=""bib32""",23_19,Research progress in stem cell therapy for Wilson disease,15 3 2024,,Wilson_Disease
"DMSA, zinc acetate</td><td>[<xref rid=""bib32"" ref-type=""bibr"">32</xref>]</td></tr><tr><td>Other systemic diseases</td><td>Coombs-negative haemolytic anaemia, rhabdomyolysis</td><td>Hemodialysis, plasmapheresis</td><td>[<xref rid=""bib33"" ref-type=""bibr"">33</xref>,<xref rid=""bib34"" ref-type=""bibr"">34</xref>]</td></tr></tbody></table></table-wrap> When WD patients experience late-stage symptoms, such as, acute liver failure or decompensated cirrhosis, liver transplantation (LT) is the only feasible treatment",23_20,Research progress in stem cell therapy for Wilson disease,15 3 2024,,Wilson_Disease
"(LT) is the only feasible treatment option [<xref rid=""bib20"" ref-type=""bibr"">[20]</xref>, <xref rid=""bib21"" ref-type=""bibr"">[21]</xref>, <xref rid=""bib22"" ref-type=""bibr"">[22]</xref>]. Given that WD primarily affects the liver and is characterized by impaired copper metabolism in hepatocytes, liver transplantation can be viewed as a corrective measure for the gene deficiency, effectively restoring copper homeostasis and addressing the phenotypic manifestations of the disease. After LT, biliary copper",23_21,Research progress in stem cell therapy for Wilson disease,15 3 2024,,Wilson_Disease
"of the disease. After LT, biliary copper excretion is restored, neurologic and mental illness stabilize or improve, and Kayser-Fleischer rings gradually disappear [<xref rid=""bib23"" ref-type=""bibr"">[23]</xref>, <xref rid=""bib24"" ref-type=""bibr"">[24]</xref>, <xref rid=""bib25"" ref-type=""bibr"">[25]</xref>]. Nevertheless, LT is not without its inherent limitations, namely the scarcity of liver donors, the heightened frequency of postoperative complications, and the requirement for prolonged administration of",23_22,Research progress in stem cell therapy for Wilson disease,15 3 2024,,Wilson_Disease
"the requirement for prolonged administration of immunosuppressive agents. Additionally, paradoxical neurological deterioration may be seen in transplant recipients, and there is still ongoing debate about whether uncontrolled neurological symptoms alone should be considered a sufficient indication for liver transplantation [<xref rid=""bib20"" ref-type=""bibr"">20</xref>]. Given the ability of transplanted hepatocytes to integrate into the liver parenchyma and reinstate crucial functions, such as facilitating",23_23,Research progress in stem cell therapy for Wilson disease,15 3 2024,,Wilson_Disease
"reinstate crucial functions, such as facilitating copper transfer into bile, it seems that cell-based therapies hold promise as a feasible approach for treating WD [<xref rid=""bib35"" ref-type=""bibr"">35</xref>]. Park et al. conducted intrasplenic injection of healthy hepatocytes into 8-week-old Long-Evans Cinnamon (LEC) rats exhibiting clinical symptoms of WD due to mutant <italic toggle=""yes"">ATP7B</italic> [<xref rid=""bib36"" ref-type=""bibr"">36</xref>]. After 16 weeks post-transplantation, all transplanted",23_24,Research progress in stem cell therapy for Wilson disease,15 3 2024,,Wilson_Disease
"16 weeks post-transplantation, all transplanted rats exhibited restored biliary copper excretion and reduced hepatic copper concentration, causing improved 6-month survival rates in LEC rats. The results were further confirmed by Sauer et al. through repeated transplantation, they found that multiple hepatocyte transplantations led to better outcomes without requiring preconditioning [<xref rid=""bib37"" ref-type=""bibr"">37</xref>]. Based on current data, it is estimated that restoring normal copper",23_25,Research progress in stem cell therapy for Wilson disease,15 3 2024,,Wilson_Disease
"it is estimated that restoring normal copper metabolism requires the transplantation of approximately 40% of healthy hepatocytes. However, the limited supply of primary human hepatocytes (PHHs) poses a barrier, thereby limiting the feasibility of PHHs therapy as a potential treatment option for WD [<xref rid=""bib38"" ref-type=""bibr"">38</xref>]. Stem cells have the advantages of self-renewal and differentiation into various cell types, including hepatocytes. With the ongoing advancement of in vitro-directed",23_26,Research progress in stem cell therapy for Wilson disease,15 3 2024,,Wilson_Disease
"With the ongoing advancement of in vitro-directed induced differentiation techniques, stem cell-derived hepatocytes have the potential to serve as a stable source of cells. Recent scientific research has showcased the immense potential of various types of stem cells in the field of regenerative medicine, such as mesenchymal stem cells (MSCs), induced pluripotent stem cells (iPSCs), embryonic stem cells (ESCs) and other stem cells. Through in vitro induction technology, stem cells can be programmed to",23_27,Research progress in stem cell therapy for Wilson disease,15 3 2024,,Wilson_Disease
